company_name,job_title,location,page_number,posted_time,search_keyword,technologies,years_of_experience
Get AI Driven,AI Solutions Architect,Cairo,5,20 days,frontend,"·, AI, Architecture, Computer Engineering, APIs, Computer Science, DevOps, Engineering, English, JavaScript",
Nacita,Full-stack Software Engineer,Cairo,5,21 days,frontend,"·, full-stack engineer, software engineeer, angular, Agile, Java, nodejs, Kubernetes, Google Cloud",
Bright Creations,Backend Developer (Laravel),Smart Village,5,,frontend,"·, Engineering, APIs, Laravel, PHP, Back-End Development, Full Stack Development, Computer Science, Information Technology (IT)",
SURE International Technology,Senior React JS Developer,Nasr City,5,,frontend,"·, React, JavaScript, React js",
Confidential,PHP Developer,Maadi,5,10 days,frontend,"·, Laravel, MySQL, PHP, Software Development, Git, OOP, Vue.js, RESTful APIs, Systems Integration",
classera,Full Stack Developer,New Beni Suef,5,,frontend,"·, Computer Science, Java, MySQL, React, .Net, Full Stack, Software Development",
Devency  ,Backend Engineer,Nozha,5,12 days,frontend,"·, Software Development, Engineering, Typescript, Node.js, NoSQL, SQL, Software Engineering, backend",
Advanced Solutions,Technical Support Engineer,Nasr City,5,16 days,frontend,"·, Microsoft SQL Server, SQL, Oracle, Configure, Install, Troubleshoot, IIS, Integration, Application Support",
bluworks ,Senior Backend Developer,Maadi,5,,frontend,"·, Backend developer, backend, Software Development, Software Engineering",
Confidential,Frappe & ERPNext Developer,Riyadh,5,26 days,frontend,"·, Python, jQuery, JavaScript, HTML, erpnext, CSS, Computer Science",
Code SA Ltd,Senior Software Engineer,Cambridge,3,10 days,Cloud,"·, Python, APIs, Docker, React.js, Flask, FastAPI, Django, Software Development",
Confidential,Backend Team Lead,Smouha,3,21 days,Cloud,"·, backend, Communication skills, Scrum, Java, Spring Boot, Microservices Architecture",
Mint-Ops,Full Stack Developer,Nasr City,3,,Cloud,"·, Agile, CSS, Development, Git, JavaScript, Node.js, JIRA, Slack, PostgreSQL",
Trilogy,"Vice President of Product Engineering, 2 Hour Learning (Remote) - $400,000/year USD",Dubai,3,,Cloud,"·, computer science, information technology (it), computer engineering, project management, aws, engineering, software",
TAB ERP Solutions,IT Specialist,New Cairo,3,,Cloud,"·, Information Technology (IT), Networking, Configuration, SQL Server, DevOps, IT, Hardware, Computer Science, computer",
Link Development,AI Engineering Manager,Cairo,3,,Cloud,"·, Computer Science, BI, Software Engineering, SQL, Software Development, Power BI, SSRS, SQL Server",
MySender,Junior Business Development Specialist GCC,New Cairo,3,,Cloud,"·, Business developer, sales skills",
MOBILY INFOTECH LTD INDIA,Oracle Fusion consultant,Cairo,3,,Cloud,"·, Fusion, Oracle Fusion, APEX",
DewanSoft,B2B Sales Executive – Infrastructure SaaS,Haram,3,,Cloud,"·, B2B Sales, business, B2B, Sales, sales skills, Sales Target, Technical Sales",
Smartly,"Front-End Developer (Blazor, React, Vue, Angular)",Nasr City,3,23 days,Cloud,"·, Blazor, React, Vue.js",
Softec Technologies,Python Team Lead - AI & Python Engineering,Cairo,3,23 days,Cloud,"·, API, AWS, Communication skills, Computer Science, Development, Docker, Engineering",
SURE International Technology,PHP Team Lead,Nasr City,3,23 days,Cloud,"·, Laravel, Software, Computer Science",
Algoriza,Senior Full Stack Developer ( Node Js & React),Giza,3,9 days,Cloud,"·, AWS, Computer Science, CSS, front-end, HTML, Information Technology (IT), JavaScript",
Link Development,GTM Lead,Cairo,3,11 days,Cloud,"·, Software Development, Amazon AWS",
ECC Group,Moodle Developer – API Integration Specialist,Nasr City,3,25 days,Cloud,"·, APIs, Computer Science, CSS, Git, HTML, Information Technology (IT), Integration, JavaScript, PHP",
Wärtsilä i Norge,Workshop Maintenance Technician,Dubai,4,,Machine learning,"·, Maintenance, Engineering, Technical Support, Mechanical Engineering, Mobile Maintenance, Information Technology (IT), Microsoft Office",
Wärtsilä,Workshop Maintenance Technician,Dubai,4,,Machine learning,"·, Maintenance, Engineering, Technical Support, Mechanical Engineering, Mobile Maintenance, Information Technology (IT), Microsoft Office",
Confidential,Mobile Application Coding Engineer,6th of October,5,,backend,"·, Software Development, Development",
Rashideen Egypt for Trade ,Software developer,Katameya,5,,backend,"·, API, Software, Software Development, CSS, Engineering, HTML, Software Engineering, Web API",
Algoriza,Senior Dot Net Developer,Giza,5,,backend,"·, .Net, Computer Science, CSS, CSS3, Design, HTML5, Information Technology (IT)",
Nahdet Misr Publishing Group,Senior Front End Developer,Mohandessin,5,,backend,"·, Information Technology (IT), Software Development, jQuery, HTML, Angular, JavaScript, Software Engineering",
Creative Motion,Odoo Developer,Maadi,5,,backend,"·, CSS, Odoo Development, Information Technology (IT), Computer Science, Python, Communication skills, Development, Engineering",
Orient Egypt,Full Stack .Net Developer,Dokki,5,,backend,"·, .Net, Engineering, HTML5, JavaScript, Software Development, Computer Science, ASP.Net",
classera,Full Stack Developer,New Beni Suef,5,,backend,"·, Computer Science, Java, MySQL, React, .Net, Full Stack, Software Development",
Confidential,Frontend Team Lead,Smouha,5,21 days,backend,"·, Agile Scrum, Angular, Communication skills, JavaScript, UI/UX design, DevOps, Dockerm Kubernetes",
Yodawy Med,Junior Full Stack Developer,Mohandessin,5,22 days,backend,"·, Computer Science, Engineering, Full Stack, Software Development, Software Engineering, JavaScript",
Ultimate Solutions Egypt,Senior Front-End Angular Developer,Victoria,5,19 days,backend,"·, Angular, APIs, Computer Science, CSS3, Design, front-end, Git",
Get AI Driven,AI Solutions Architect,Cairo,5,20 days,backend,"·, AI, Architecture, Computer Engineering, APIs, Computer Science, DevOps, Engineering, English, JavaScript",
My Business Care Team,Senior Developer/Manager (Full-Stack + ML Ops),Cairo,5,23 days,backend,"·, AWS, Information Technology (IT), Software, Software Development, DevOps, Cloud, Lambda, EC2, DynamoDB",
CookDocs,Administrative Assistant,Maadi,5,17 days,backend,"·, Administration, administrative, Communication, Coordination, Email, English, Operations, meetings, Administrative tasks",
Dakkaken Group,Senior Vendure & Next.js Developer,Cairo,5,24 days,backend,"·, Docker, Node.js, JavaScript, Development, Js, Software Development, PostgreSQL, NestJS, Vendure",
Ultimate Solutions Egypt,Senior UI Angular Developer,Sheikh Zayed,5,19 days,backend,"·, Aesthetics, Angular, Computer Science, Design, Development, Figma, Information Technology (IT)",
Korea Hydro Nuclear Power co.LTD (KHNP)  ,"Junior Engineer (Design Engineer, Civil)",Dabaa,6,9 days,Data engineer,"·, Architecture, Design, English Teaching, power plant, civil",
engineering tracks,Data Entry,Nasr City,6,18 days,Data engineer,"·, Microsoft Office, Administration, Customer Service, Communication, computer, English",
Style Design,B2B Sales Engineer,Sheikh Zayed,6,9 days,Data engineer,"·, B2B, Sales B2B, Applied Arts, B2B Sales, business, Customer, Design, Furniture",
LIVING IN INTERIORS EGYPT,IT Network Engineer,New Cairo,6,15 days,Data engineer,"·, Networks, Computer, CCNA, Information Technology (IT), Database, Internet",
Confidential,Quality Control Engineer,6th of October,6,15 days,Data engineer,"·, Food, quality, Quality Management, Quality Control, Control, Skills, Communication, ISO 22000",
Gazelle Envelope Manufacturers ,Quality Manager,6th of October,6,,Data engineer,"·, Manufacturing, Production, Administration, Quality Assurance, Quality Control",
EME,Electrical Sales Engineer,Heliopolis,6,11 days,Data engineer,"·, Communication, Electrical, Sales, sales skills",
Chemipharm ,Senior system Admin Engineer,6th of October,6,17 days,Data engineer,"·, computer, Computer Science, Information Technology (IT), System Admin",
Tree,Textile Engineer - Quality,Glim,6,17 days,Data engineer,"·, Clothing, Manufacturing, Communication skills, Operations, Factories, Export",
Roots Group ,Project Engineer ( On-Site),Port Said,6,,Data engineer,"·, Project Coordination, Construction Documentation, Quality Control Inspections, Change Order Management, Project Management Tools",
Confidential,Quality Engineer - QC/QA,khanka,6,18 days,Data engineer,"·, Quality Control, QA, Quality Assurance, QC, English, Manufacturing",
IETOS,Procurement Engineer,Sheraton,6,11 days,Data engineer,"·, Supply Chain, Purchasing, Procurement",
Eleven Eleven Property Management,Senior Site Engineer,New Cairo,6,12 days,Data engineer,"·, Construction, Communication, Site, AutoCAD, Civil, Design, Management",
Efada Technology,"BI ""Data warehouse""",6th of October,6,21 days,Data engineer,"·, BI, Computer Science, Information Technology (IT), Oracle, SQL, PLSql",
COLAS RAIL Egypt,Requirements and Configuration Engineer,Abdeen,6,9 days,Data engineer,"·, Configuration",
Joya Amplify ,Marketing Specialist,Cairo,4,,Ai,"·, Digital Marketing, Content, SEO, Advertising, Digital, digital marketing, E-Marketing, Editing, Marketing",
Trevor Sadd Associates,Online Quantity Surveying Course / Internship (Remote),Cairo,4,,Ai,"·, Quantity Surveying, Engineering, Architecture, Civil Engineering, Structural Engineering, Technical Office Engineering, Tendering, Architectural Engineering",
MeatHouse,HR Administrator,New Cairo,4,,Ai,"·, Business Administration, Administration, Communication, Human Resources (HR), Recruitment, Personnel, English, Microsoft Office, Payroll",
Bright Creations,DAZU - Python Developer (FinTech),Smart Village,4,,Ai,"·, Python, Django, Flask, Python Scripting, Web Scraping, WWeb Scraping, CI, Computer Science",
Confidential,Executive Assistant,New Cairo,4,18 days,Ai,"·, Administration, Office management, Organizational skills, business, Presentation Skills, Microsoft Office",
INTERNET SOLUTIONS,Senior Digital Marketing Specialist,Sheikh Zayed,4,18 days,Ai,"·, E-Marketing, digital marketing, Digital Marketing, media, Social Media, Marketing, Communication skills",
ICON Holding,Marketing Insights & Strategy Analyst,Helwan,4,,Ai,"·, Analysis, Analyst, Market Research, Marketing, Sales, SEO",
WUZZUF,Senior Digital Marketing Specialist,Maadi,4,18 days,Ai,"·, Adobe Photoshop, Communication, Communication skills, E-Marketing, facebook, instagram, Marketing, media",
WGG Advertising Agency,Graphic Designer,Cairo,4,13 days,Ai,"·, After Effects, Graphic Design, English, Figma, Adobe Photoshop, Adobe illustrator",
DigiMora,Sales & Business Development Executive,Cairo,4,9 days,Ai,"·, Business Development, B2B Sales, business, Communication, Development, Sales Target, sales skills, Negotiation",
MeatHouse,Marketing Coordinator,New Cairo,4,,Ai,"·, MS Office, Communication, Digital Marketing, Social Media, Computer Skills, digital marketing, Coordinator, E-Marketing",
Bright Creations,Fintech - Head of Engineering,Smart Village,4,,Ai,"·, Agile, back-end, Engineering, Computer Science, front-end, Management, Project Management",
Bright Creations,Project/Product Manager,Smart Village,4,,Ai,"·, JIRA, Project, Project Coordination, Product Management, Project Management",
Confidential,Client Success Manager,Barnsley,4,,Ai,"·, Marketing Strategy, Sales, Marketing, Copywriting, Consulting, Customer Care, client",
Aman ,Graphic Designer,Maadi,4,16 days,Ai,"·, Graphic Design, Adobe Photoshop, Adobe illustrator, Adobe Suite, indesign, Marketing, photoshop, adobe, Applied Arts",
ROOT IQ,Sales Representative – ERP Systems,Cairo,7,,software,"·, ERP, B2B, Communication, Negotiation, Sales, sales skills, Sales Target, Skills",
Lumin,Senior Scrum Master,Sheikh Zayed,7,,software,"·, Information Technology (IT), Agile, Computer Science, Scrum Master, Scrum, Development",
Al Ateeq Software,Senior Front End Developer,Heliopolis,7,,software,"·, Angular, Communication skills, Computer Science, front-end, Information Technology (IT), UI/UX, Development",
Order King,Software Sales representative,Sheraton,7,2 months,software,"·, Sales, Hotel, Restaurant, Cafe, sales skills, Sales Target, Information Technology (IT)",
Fixed Solutions,Presales Engineer,Cairo,7,9 days,software,"·, Pre-Sales, Sales engineer, sales skills, Science, Computer Science",
Confidential,Senior Flutter Developer (On-site),Nasr City,7,8 days,software,"·, Android Development, Flutter, APIs, iOS, Android, Github, Information Technology (IT), Flutter developer",
AIU,IT Help Desk,Alamein,7,8 days,software,"·, Computer Science, Help desk, Information Technology (IT), Computer Systems, Communication, computer, Hardware, Networking",
Confidential,Customer Support Representative,Sheraton,7,8 days,software,"·, Communication, Customer Service, Customer Support, Microsoft Word, Sales, Customer Care",
Youxel,Scrum Master,Maadi,7,,software,"·, Agile, Computer Science, Information Technology (IT), Scrum Master, Scrum, Master, automated testing",
Aswaq,IT Specialist,Cairo,7,8 days,software,"·, Information Technology (IT), Computer Science, HelpDesk, Technical Support, Hardware Maintenance",
softprimes,Odoo Developer (80% Remote),Nasr City,7,8 days,software,"·, HTML5, Full Stack, Odoo, python",
PDC CRO,Accountant,Cairo,7,9 days,software,"·, Financial Analysis, Financial Management, Accounting, English, MS Office, Arabic, Economics, Finance",
Informatique Education,Technical Project Manager,Cairo,7,9 days,software,"·, Computer Science, Development, Engineering, Information Technology (IT), IT, Management, Education",
Naba Soft ,ERP Sales Consultant,Riyadh,7,10 days,software,"·, ERP, Sales, sales skills, Sales Target, Selling",
Comsys Software,Marketing Executive,Heliopolis,7,9 days,software,"·, Communication, Market Research, media, Social Media, Media Buying, Content Creation, Content Marketing",
Seoudi Supermarket,Senior Full Stack Developer (Laravel - Vue.js),Sheikh Zayed,6,,frontend,"·, MySQL, Computer Science, CSS3, Full Stack, Git, HTML5, Information Technology (IT), React",
Confidential,Mobile Application Coding Engineer,6th of October,6,,frontend,"·, Software Development, Development",
Orient Egypt,Full Stack .Net Developer,Dokki,6,,frontend,"·, .Net, Engineering, HTML5, JavaScript, Software Development, Computer Science, ASP.Net",
Code SA Ltd,Senior Software Engineer,Cambridge,6,10 days,frontend,"·, Python, APIs, Docker, React.js, Flask, FastAPI, Django, Software Development",
CodeCooks,Full Stack Developer,New Cairo,6,17 days,frontend,"·, Full Stack Developer, Information Technology (IT), Computer Science, Software Development, Full Stack",
Exco Egypt,UIUX Designer,Nasr City,6,8 days,frontend,"·, CSS, JavaScript, UI/UX, ui, UX, UX Design, Sketch",
Confidential,NET Programmer,Sur,6,9 days,frontend,"·, Computer Science, SQL, Programming, .Net, ASP.Net, C#, Development, HTML, Information Technology (IT)",
Swift Distribution,Website Senior Developer HTML,Downtown,6,14 days,frontend,"·, CSS3, HTML, JavaScript, Design",
My Business Care Team,Senior Developer/Manager (Full-Stack + ML Ops),Cairo,6,23 days,frontend,"·, AWS, Information Technology (IT), Software, Software Development, DevOps, Cloud, Lambda, EC2, DynamoDB",
Algoriza,Senior . Net Developer,Giza,6,14 days,frontend,"·, Computer Science, Development, Information Technology (IT), Software Development, Software Engineering",
Confidential,Full Stack Team Lead,Dubai,6,22 days,frontend,"·, Azure, back-end, Development, Information Technology (IT), Cloud, HTML, Computer Science, CSS, Java",
Softxpert Incorporation ,Senior Python Developer,Bolkly,6,22 days,frontend,"·, APIs, Angular, Software Development, Software Engineering, Web Development, MySQL, Python",
TXG ,Mid - Senior Backend Developer (Node.js),Cairo,6,18 days,frontend,"·, Git, TypeScript, API, PostgreSQL, Github, CI/CD, Node.js, Fastify, REST",
TXG.,Senior Backend Developer (Node.js),Cairo,6,19 days,frontend,"·, API, backend, CI/CD, Github, PostgreSQL, REST, Fastify, Node.js, Typescript",
Ultimate Solutions Egypt,Senior Full Stack Developer,Sheikh Zayed,6,19 days,frontend,"·, Angular, API, Computer Science, Design, CSS3, Development, Docker",
Gahbiz.com,Web Developer,Sidi Gaber,4,,Cloud,"·, API, backend, Computer Science, Development, front-end, Information Technology (IT), Js, Laravel, Node.js",
ISTQSERVERS ,Full Stack Team Leader,Maadi,4,,Cloud,"·, Full Stack, Node.js",
Logistica,IT Assistant Manager - Sokhna Site,Ataqah,4,,Cloud,"·, Information Technology (IT), Computer Science, Database, ERP, networks",
Square Engineering Firm,Information Structuring Senior Officer,Madinaty,4,,Cloud,"·, Computer Science, Information Technology (IT), Software Development, Data Structure",
Link Development,Software Engineering Lead – Dynamics 365 CRM and Power Platform,Maadi,4,,Cloud,"·, Microsoft Dynamics CRM, Dynamics 365, MS Dynamics 365, Microsoft Power BI, .Net, CRM, English, Software, Software Development",
Pure Group ,AI Engineer,Cairo,4,,Cloud,"·, AI, LMS, FFT, Python, Engineering, Frameworks, PyTorch, TensorFlow, NLP",
Bright Creations,Fintech - Head of Engineering,Smart Village,4,,Cloud,"·, Agile, back-end, Engineering, Computer Science, front-end, Management, Project Management",
Bright Creations,Backend Developer (Laravel),Smart Village,4,,Cloud,"·, Engineering, APIs, Laravel, PHP, Back-End Development, Full Stack Development, Computer Science, Information Technology (IT)",
Core Construction and Finishing  Egypt,Technical Office Architect,Heliopolis,4,,Cloud,"·, Architecture, AutoCAD, Engineering, Technical Office, technical",
Avanguard,E-Learning Operation Manager.,New Cairo,4,,Cloud,"·, business, Business Administration, E-Marketing, Communication, LMS, Management, Operations, Project Management, Administration",
Connectra,IT Presales Engineer,Cairo,4,22 days,Cloud,"·, Engineering, Information Technology (IT), Presales Engineering, CCNA, IT, English, Cisco",
Confidential,Network Engineer,Cairo,4,8 days,Cloud,"·, CCNP, Communication, Presales, Design, Sales, Engineering, HCIP, HCIA, HCSP",
Fixed Solutions,Presales Engineer,Cairo,4,9 days,Cloud,"·, Pre-Sales, Sales engineer, sales skills, Science, Software, Software Development, Computer Science",
Korea Hydro Nuclear Power co.LTD (KHNP)  ,Junior Engineer [Specialist Contract],Dabaa,4,9 days,Cloud,"·, Engineering, Contracts, English language, Russian Language, Construction Engineering, construction feild, nuclear powerplant",
Korea Hydro Nuclear Power co.LTD (KHNP)  ,"Junior Engineer (Construction Engineer, Civil)",Dabaa,4,9 days,Cloud,"·, Civil Engineering, Civil, Construction, Engineering, English, Power Plant, Nuclear Engineering",
Ultimate Solutions Egypt,Senior Full Stack Developer,Sheikh Zayed,6,19 days,backend,"·, Angular, API, Computer Science, Design, CSS3, Development, Docker",
CodeCooks,Full Stack Developer,New Cairo,6,17 days,backend,"·, Full Stack Developer, Information Technology (IT), Computer Science, Software Development, Full Stack",
ITIDA,Web Developer,Smart Village,6,24 days,backend,"·, Web Development, Computer Science",
Exceed,Senior PHP Developer (Laravel Expert),Cairo,6,21 days,backend,"·, Laravel, MySQL, PHP, API, Computer Science, Software Development, REST, Information Technology (IT)",
Mersal ,Engineering Director,Maadi,6,21 days,backend,"·, Civil Engineering, Leadership, Management, Project Management, Architectural Engineering, MEP Engineering",
Saikoro,Junior Web Developer,Cairo,6,21 days,backend,"·, Computer Science, API, CSS, HTML, MySQL, PHP, React, Software Development, Web Development",
"Telecom Systems Provider, LLC",Front End Developer,Maadi,6,24 days,backend,"·, CI/CD, Android, Computer Science, Software Engineering, Software, iOS, REST, Development, Information Technology (IT)",
Specialized Seamless Services ,Software Engineer,Cairo,6,24 days,backend,"·, CCNA, mssa, Radiology Information System, Computer Science, Information Technology (IT), SQL, Software Development",
Devency  ,Frontend Engineer,Nozha,6,,backend,"·, Software Development, Engineering, React, React.js, UI, front-end, Typescript, Agile",
ISTQSERVERS ,Full Stack Team Leader,Maadi,6,,backend,"·, Full Stack, Node.js",
Seoudi Supermarket,Senior Full Stack Developer (Laravel - Vue.js),Sheikh Zayed,6,,backend,"·, MySQL, Computer Science, CSS3, Full Stack, Git, HTML5, Information Technology (IT), React",
Charisma Design,Frontend,Nasr City,6,,backend,"·, HTML5, CSS3, JavaScript, Vue.js, nuxstjs",
INTELLEVO,Senior Digital Marketing Specialist,Dokki,6,,backend,"·, Digital Marketing, Social Media Advertising, Media Buying, Ads, Social Media, Ecommerce, eCommerce Advertising, Product Listing Optimization, Website Analytics",
Itechs Group,Software Engineer (Frontend),Nasr City,6,,backend,"·, CSS3, Git, HTML5, JavaScript, Redux, RESTful, Information Technology (IT), Software Engineering",
SURE International Technology,Senior React JS Developer,Nasr City,6,,backend,"·, React, JavaScript, React js",
Confidential,Planning Engineer,Riyadh,7,16 days,Data engineer,"·, Project Management, Cost Control, Primavera, Software, Construction",
Sinoma-cdi,Research And Development Engineer,Cairo,7,12 days,Data engineer,"·, Research, TO",
Softec Technologies,Python Team Lead - AI & Python Engineering,Cairo,7,23 days,Data engineer,"·, API, AWS, Communication skills, Computer Science, Development, Docker",
Core Construction and Finishing  Egypt,Business Development Engineer/Manager,Heliopolis,7,,Data engineer,"·, Business Development, Management, Development, sales skills, business",
Nesstra Egypt ,HVAC Technical Office Engineer,6th of October,7,13 days,Data engineer,"·, AutoCAD, Design, HVAC, Mechanical, Microsoft Office, Revit",
green river for urban development,Civil Site Engineer,Badr City,7,10 days,Data engineer,"·, Architecture, Construction",
Modern Interiors Design – Construction,Senior Planning Engineer,Mohandessin,7,21 days,Data engineer,"·, Primavera, Claims, MEP, Project Management, BOQ, Design",
أكاديمية ابداع للتدريب والاستشارات (Ibdaa Academy),Engineer-,Fleming,7,14 days,Data engineer,"·, Computer Science, Information Technology (IT), Arduino, Python, Teaching, Development, Software Development",
Minraf ,Mechanical Production Engineering,Obour City,7,13 days,Data engineer,"·, Education, Product Development, Product, Production, Systems",
Devency  ,Backend Engineer,Nozha,7,12 days,Data engineer,"·, Software Development, Typescript, Node.js, NoSQL, SQL, backend",
Nacita,Full-stack Software Engineer,Cairo,7,21 days,Data engineer,"·, software engineeer, angular, Agile, Java, nodejs, Kubernetes, Google Cloud",
Maalem-Group,Civil Technical office Engineer,New Cairo,7,14 days,Data engineer,"·, Communication, Management",
Confidential,Project Planning Engineer,Shorouk City,7,14 days,Data engineer,"·, Project, Communication, Computer Science, Construction, Information Technology (IT), Leadership, Management",
Roya Developments,Senior IT Operation Engineer,Sheraton,7,,Data engineer,"·, CCNA, Information Technology (IT), IT, Configuration, Computer Science, Troubleshooting, Software Development",
Promech Engineering,Electrical Maintenance Engineer (CNC Machines),Maadi,7,14 days,Data engineer,"·, Electrical, Electrical Maintenance, CNC Machines",
Scientific Gate ,Motion Graphic Designer,Nasr City,5,,Ai,"·, Adobe illustrator, Adobe Photoshop, After Effects, Design, Creative, Graphic, Graphic Design",
Confidential,Content Creator and Blog Writer,New Cairo,5,12 days,Ai,"·, Content, content creator, English, writer, Writing, Blogging, Blog Creation, Content Writing",
Confidential,Senior Design Architect,New Cairo,5,19 days,Ai,"·, Architecture, photoshop, Design, 3ds Max, Revit, Rhino",
Confidential,IT Manager,6th of October,5,19 days,Ai,"·, Information Technology (IT), IT",
34ML,Cloud Infrastructure Engineer,Heliopolis,5,11 days,Ai,"·, Software Development, Information Technology (IT), Web Development, Computer Engineering, Software Engineering, PHP, Laravel, Image Recognition",
Dora Management Solutions,Photo Editor,Sheraton,5,14 days,Ai,"·, Adobe Photoshop, Affinity Photo, Design, Digital technology, Editing Software Packages, Photo Editing, media, Creative",
Confidential,Full Stack Team Lead,Dubai,5,22 days,Ai,"·, Azure, back-end, Development, Information Technology (IT), Cloud, HTML, Computer Science, CSS, Java",
Seoudi Supermarket,Performance Marketing Specialist,Sheikh Zayed,5,15 days,Ai,"·, Digital Marketing, Google Analytics, SEO, Performance Marketing, Appsflyer, Kochava",
CLS Learning Solutions,Instructors (Min 5 Years Exp.),Cairo,5,18 days,Ai,"·, Training, Teaching, Computer Engineering, Computer Science, Development, Education, Instructor, Science, Software",
Smart Group,Medium Voltage Design Engineer,10th of Ramadan City,5,18 days,Ai,"·, AutoCAD, Design, Electrical Engineering, Medium Voltage",
DigiMora,Sales Marketing Executive,Heliopolis,5,25 days,Ai,"·, B2B Sales, Sales, sales skills, Marketing, Selling, Sales Target, Digital",
Axone Data,IT Sales Representative,Cairo,5,28 days,Ai,"·, Computer Science, Marketing, Software Development, B2B, business, Communication, Customer Service, IT sales, IT",
Professional Service Proserv,Content Creator,New Cairo,5,1 month,Ai,"·, Content, content creator, Creative, English, Social Media, Marketing, SEO",
Itechs Group,B2B Sales Account Manager,Nasr City,5,25 days,Ai,"·, Business Development, Customer Care, Customer Service, English, Sales, sales skills, Sales Target",
Al fawzy dental,Digital Marketing Manager,Downtown,5,,Ai,"·, Digital Marketing, Online Marketing, Google Ads, SEO, Kpi, Moderation, campaigns, CRM",
Amer Vision Group,Video Editor,Sheraton,8,9 days,software,"·, Adobe After Effects, Adobe Photoshop, Creative, Design, Editing, Graphic Design, video",
