company_name,job_title,location,page_number,posted_time,search_keyword,technologies,years_of_experience
Confidential,Project Coordinator,Cairo,9,2 months,Ai,"·, Construction, Management, Project, Project Management, Project Coordination",
Scib Paints,Senior Digital Marketing Specialist,Giza,9,2 months,Ai,"·, Digital, Digital Marketing, E-Marketing, Google Ads, Google Analytics, media, SEO, Social Media, Marketing",
Intouch CX ,Customer Service Operation Manager,Maadi,9,2 months,Ai,"·, Customer Service, Operations, Customer Care, Communication skills",
Monglish Academy,Technology Director,Cairo,9,2 months,Ai,"·, IT, Information Technology (IT), Computer Science, Information technology, Engineering, Software Engineering, Cloud, Software Development, Technology",
Goldbar,Executive Assistant (Admin & Operations),Cairo,9,2 months,Ai,"·, Administration, Assistance, Office management, Secretary, Executive, HubSpot, GoHighLevel, Google Suite",
Younis Architects,"Archviz Artist - Visualizer , Architect and/or Interior designer",Cleopatra,9,2 months,Ai,"·, Architecture, Interior Design, Architectural Visualization, Visualization, Autodesk 3ds Max, 3ds Max, corona",
Confidential,Call Center Manager,Maadi,9,2 months,Ai,"·, Call Center, Communication skills, Management, Customer Support, Customer Service, Customer Care, CRM",
Confidential,Call Center Agent,Maadi,9,2 months,Ai,"·, English, Customer Support, Communication skills, CRM, Customer Service",
Charisma Design,Backend Developer,Nasr City,9,28 days,Cloud,"·, Agile, Computer Science, API, Information Technology (IT), PHP, Laravel, Software Development",
MATECH,Datacom – Networking presales engineer,Nasr City,9,1 month,Cloud,"·, Information Technology (IT), network, IT, Engineering",
Royal Cyber,Project Manager,Riyadh,9,1 month,Cloud,"·, PMP, Project, Project Management, Agile, Project Manager, Stakeholders",
Contact,.Net developer,Downtown,9,1 month,Cloud,"·, Computer Science, Information Technology (IT), .Net, Software Development, NET, developer, Agile, Angular, ASP.Net",
HITS Solutions,IoT Engineer,Nasr City,9,2 months,Cloud,"·, IOT, Engineering, Computer Science, Information Technology (IT), MQTT, Embedded Systems, Python",
Sam Tech,Technology Sales Specialist,New Cairo,9,1 month,Cloud,"·, Sales Field, Marketing Online, Computer Science, communications, business, Information Technology (IT), Sales",
Specialized Seamless Services ,"Network, Security & Technical Support Specialist",Cairo,9,1 month,Cloud,"·, Firewall, Networking",
Confidential,Executive Secretary - Management control,Cairo,9,1 month,Cloud,"·, Administration, Office management, Project Management, Communication skills, Operations, Secretary, Management",
EZeats ,Senior Backend Developer,Heliopolis,9,2 months,Cloud,"·, backend, Computer Science, Information Technology (IT), Software Development, Engineering, Development, AWS, Node.js",
Confidential,"Full Stack Developer (Laravel, Node.js, Express, MySQL, React)",Nasr City,9,2 months,Cloud,"·, Engineering, Information Technology (IT), PHP, MySQL, Software Development, Laravel, JavaScript, Git, Computer Science",
Royal Cyber,Asp.Net Developer,Riyadh,9,2 months,Cloud,"·, .Net, Dot Net, ASP.Net, .Net core, SQL, Identity Server, MVC",
Madar Soft,iOS Developer,Fleming,9,1 month,Cloud,"·, Computer Science, Core Data, Core Animation, Information Technology (IT), Git, iOS, Objective-C, RESTful",
Green Foods,IT and AI Specialiat,Cairo,9,1 month,Cloud,"·, AI, computer, Computer Science, Information Technology (IT), Machine Learning",
Confidential,IT Manager,Nozha,9,2 months,Cloud,"·, Information Technology (IT), Management, IT, Project Management",
Xceed Contact Center,Telecommunication Support Engineer,Giza,9,2 months,Cloud,"·, CCNA, CCNP, Computer Science, Telecommunication, communications, Engineering, Information Technology (IT), Telecommunication Systems Software",
Delta Egypt For Lighting ,Junior Tender Engineer,Obour City,11,23 days,Data engineer,"·, Communication skills, Electrical, Tendering, Lighting, Power, SAP",
Nasr City Solar,Electrical Engineer,Hurghada,11,24 days,Data engineer,"·, Electrical, Safety, Communication, Design, Electrical manufacturing",
HCH-Supply--Egypt,Sr. Mechanical Sales Engineer,Cairo,11,24 days,Data engineer,"·, Mechanical, sales skills, technical, B2B",
Wadi Degla Clubs ,QS Senior Engineer,New Cairo,11,24 days,Data engineer,"·, AutoCAD, Design, Construction, Computer Science, Revit, English",
Ovo Egypt,Operational Excellence Specialist,6th of October,11,22 days,Data engineer,"·, PMP, LEAN, Management, Six Sigma, Operations, Project Management, Production Process",
Cerebrus Corporation,Mechanical Design Engineer - R&D,Cairo,11,25 days,Data engineer,"·, Design, Drawings, SolidWorks, English, Mechatronics, Mechanical",
D&B,Mechanical Site Engineer,Cairo,11,25 days,Data engineer,"·, AutoCAD, HVAC, Plumbing, technical, Microsoft Word, Microsoft Excel",
Petro-Teq for industrial solution,Bid/Tendering Engineer ( Females Only),Smouha,11,25 days,Data engineer,"·, English, Mechanical, Microsoft Office, Procurement, Tendering",
Abou Seif Group ,Mechatronic Production Engineer,Obour City,11,25 days,Data engineer,"·, AutoCAD, CNC, Maintenance, Mechanical, Mechatronics",
Conserv,Business Developer & Contract Engineer,New Cairo,11,25 days,Data engineer,"·, Architecture, Business Development, Construction, Civil, CLAC, Contract",
Alumil,Architect Engineer - Marketing Position,Heliopolis,11,24 days,Data engineer,"·, Architecture, Architect, Design, Aluminum, Wholebuilding Materials, Aluminium Constructions, Interior Building Solutions.",
Samman  Engineering & Consulting,Senior Mechanical Procurement Engineer,Dokki,11,25 days,Data engineer,"·, Mechanical, Procurement, Mechanical procurement",
New Plan ,Senior Electrical Site Engineer ( Construction Company ),New Capital,11,23 days,Data engineer,"·, Construction, AutoCAD, Electrical",
Deutschland Technology Limited,Technical Pre-Sales Engineer,Obour City,11,25 days,Data engineer,"·, Mechanical, Sales, Sales Target, Sales Skills, Communication",
BI-Technologies,Full stack Developer (.Net Core & Angular),New Cairo,11,24 days,Data engineer,"·, ASP.NET, Software Development, .NET, Information Technology (IT), Full Stack, Computer Science",
Seoudi Supermarket,Senior Full Stack Developer (Laravel - Vue.js),Sheikh Zayed,1,,full stack,"·, MySQL, Computer Science, CSS3, Git, HTML5, Information Technology (IT), React",
ISTQSERVERS ,Full Stack Team Leader,Maadi,1,,full stack,"·, Node.js",
classera,Full Stack Developer,New Beni Suef,1,,full stack,"·, Computer Science, Java, MySQL, React, .Net, Software Development",
Holix,Full-Stack Developer (Next.js & NestJS),Cairo,1,9 days,full stack,"·, HTML5, Git, API, CSS3, React, MongoDB, SEO",
Smicolon GmbH,Senior Full Stack Engineer,Munich,1,11 days,full stack,"·, Git, Computer Science, APIs, Information Technology (IT), Java, JavaScript",
Confidential,"Full-Stack AI Tool Developer (React, Next.js, PostgreSQL, AWS Lambda)",New Cairo,1,12 days,full stack,"·, APIs, API, AWS, Computer Science, Engineering, HTML, Information Technology (IT)",
Confidential,Full Stack Developer,Cairo,1,,full stack,"·, next.js, tailwind, React.js, React js, Js, JavaScript, Node.js, node",
Algoriza,Senior Full Stack Developer ( Node Js & React),Giza,1,9 days,full stack,"·, AWS, Computer Science, CSS, front-end, HTML, Information Technology (IT), JavaScript",
Confidential,Data Analyst,Cairo,1,,Data Analyst,"·, Analyzing, Computer Science, Analysis, Engineering, Information Technology (IT)",
TOP EDUCATION ACADEMY ,Data Analyst and Sales Admin,Agouza,1,14 days,Data Analyst,"·, Administration, analytical, business, computer",
OPPO Egypt ,Repair Order Specialist (Data Analyst),Nasr City,1,17 days,Data Analyst,"·, Microsoft PowerPoint, Microsoft Outlook, Microsoft Word, Customer Service, After Sales, Electronics, Analysis",
HIGHBASE TRADING W.L.L,Remote Data Analyst & Processor,Cairo,1,18 days,Data Analyst,"·, Microsoft Excel, Lead Generation, vendor onboarding",
Tasaheel Finance ,Data Governance Senior Analyst,Giza,1,18 days,Data Analyst,"·, Analysis",
Al Ateeq Software,Data Analyst,Heliopolis,1,24 days,Data Analyst,"·, Computer Science, Information Technology (IT), Analysis",
Junior-Tex,Data Analyst,Cairo,1,22 days,Data Analyst,"·, Analysis, Economics, analytical, Computer Science",
Helal Group,Data Analyst,New Cairo,1,24 days,Data Analyst,"·, Analysis, analytical",
Extend for IT solutions,Data Analyst,Maadi,1,21 days,Data Analyst,"·, analytical, Analysis, BI, Power BI, business",
The Translation Gate,Financial Data Analyst,Maadi,1,23 days,Data Analyst,"·, TMS platforms, Pricing Models, Localization, SAP, NetSuite, QuickBooks, Analysis, analytical",
Confidential,Financial Analyst,Cairo,1,10 days,Data Analyst,"·, Accounting, Commerce, Analysis, Finance, Financial Analysis, Planning",
Confidential,Market Research Analyst,Heliopolis,1,8 days,Data Analyst,"·, Analysis, analytical, Communication, Market Research, Presentation, Research, Statistics, Social Media",
Confidential,Junior Business Analyst,Giza,1,17 days,Data Analyst,"·, Agile, Microsoft Excel, Business Analysis, Business Administration, Information Technology (IT), Computer Science",
Etqan Consultancy,Business Analyst,Cairo,1,25 days,Data Analyst,"·, Analysis, Computer Science, Information Technology (IT), SQL",
Electrolux,Data analyst (outsource),Nasr City,1,1 month,Data Analyst,"·, Analysis, Customer Support, Microsoft Office, Admin, excel",
eBSEG,Full Stack Developer,Maadi,1,,full stack,"·, .Net, Computer Science, Information Technology (IT), Software, Software Development, SQL, JavaScript, Development",
Mint-Ops,Full Stack Developer,Nasr City,1,,full stack,"·, Agile, CSS, Development, Git, JavaScript, Node.js, JIRA, Slack, PostgreSQL",
Ocyan,Full Stack Developer (Nuxt.js),Alexandria,1,,full stack,"·, Vue.js, RESTful APIs, SQL, ORM, Git, Responsive Design, API, Computer Science",
Orient Egypt,Full Stack .Net Developer,Dokki,1,,full stack,"·, .Net, Engineering, HTML5, JavaScript, Software Development, Computer Science, ASP.Net",
qTech. ,Senior Full Stack (.Net Developer),Mansoura,1,,full stack,"·, ASP.NET, Information Technology (IT), .NET, jQuery, Software Development, Computer Science, javaScript, C#",
CodeCooks,Full Stack Developer,New Cairo,1,17 days,full stack,"·, Information Technology (IT), Computer Science, Software Development",
ICIS,Senior Full Stack Developer .Net + Angular,New Cairo,1,9 days,full stack,"·, Engineering, Computer Science, Information Technology (IT), Oracle, SQL, Asp.Net, MVC, HTML5",
Gahbiz.com,Web Developer,Sidi Gaber,1,,Web Application Developer,"·, API, backend, Computer Science, front-end, Information Technology (IT), Js, Laravel, Node.js",
Madar Soft,Senior Web Developer,Fleming,1,,Web Application Developer,"·, Computer Science, CSS, Engineering, Information Technology (IT), HTML, MVC, jQuery",
ITIDA,Web Developer,Smart Village,1,24 days,Web Application Developer,"·, Computer Science",
Saikoro,Junior Web Developer,Cairo,1,21 days,Web Application Developer,"·, Computer Science, API, CSS, HTML, MySQL, PHP, React",
RISEUP (Endemag for Administrative Skills Development),Senior web engineer lead,Nasr City,1,,Web Application Developer,"·, JavaScript, HTML, CSS, Vuex (State Management), Vue Router, Webpack, NPM / Yarn, RESTful APIs, GraphQL",
Confidential,Senior VB6 Developer,Nasr City,1,9 days,Web Application Developer,"·, VB 6, VB, Information Technology (IT), ERP, Computer Science, JavaScript, Telecom Engineering",
National Technology,Oracle Developer,Nasr City,1,22 days,Web Application Developer,"·, Oracle, Oracle Database, Information Technology (IT), Computer Science, Oracle Forms",
Bright Creations,DAZU - Python Developer (FinTech),Smart Village,1,,Web Application Developer,"·, Python, Django, Flask, Python Scripting, CI, Computer Science",
Egabi FSI,Senior Java Developer,Sheraton,1,12 days,Web Application Developer,"·, Engineering, Git, Information Technology (IT), Java, OOP, Software, Computer Science, Software Engineering",
Etisalat Egypt,( customer service) chat account,Maadi,1,,Web Application Developer,"·, Customer Care, Customer Service, Customer Support, Commerce, Visual Arts, Corporate Law",
Etisalat Egypt,chat Advisor,Maadi,1,,Web Application Developer,"·, Customer Care, Customer Service, Customer Support, Commerce, Visual Arts, Corporate Law",
Taqin Valley,IT Sales specialist,Cairo,10,2 months,Ai,"·, IT, Information Technology (IT), Sales, sales skills, Communication skills, Account Management, business, Communication",
Trilogy,"Vice President of Product Engineering, 2 Hour Learning (Remote) - $400,000/year USD",Dubai,10,,Ai,"·, computer science, information technology (it), computer engineering, project management, aws, engineering, software",
Trilogy,"Learning Designer, 2 Hour Learning (Remote) - $100,000/year USD",Dubai,10,,Ai,"·, information technology (it), computer science, software development, engineering, education, teaching, programming",
DOT Information Technology,Senior Data Scientist,New Cairo,10,2 months,Ai,"·, Machine Learning, Information Technology (IT), Programming, NLP",
3D Diagnostix,Junior Java Developer,Maadi,10,2 months,Ai,"·, coding, Computer Science, Development, HTML, Information Technology (IT), Java, PHP, Software, Software Development",
3D Diagnostix,Java Developer (+2 years experience),Maadi,10,2 months,Ai,"·, coding, Computer Science, Development, HTML, Information Technology (IT), Java, PHP, Software, Software Development",
Confidential,Graphic Designer - B2B,Cairo,10,2 months,Ai,"·, Communication, business, Adobe Photoshop, Adobe illustrator, adobe, Graphic, indesign",
Green International Medical ,Graphic Designer,Manama,10,2 months,Ai,"·, Adobe illustrator, Adobe Photoshop, Design",
Analog AI,Senior Research Engineer,Dubai,10,,Ai,"·, Engineering, Information Technology (IT), Computer Science, Software Engineering, Software Development, Computer Engineering, Mechanical Engineering",
Zomec,Cyber Security Engineer,Riyadh,10,,Ai,"·, Information Technology (IT), Computer Science, Engineering, Security, Networking, Computer Engineering, Cisco",
Canonical,Software Engineer - Python and K8s,Riyadh,10,,Ai,"·, Information Technology (IT), Computer Science, Software Development, Software Engineering, Engineering, Computer Engineering, Software",
OPPO Egypt ,Graphic Designer,Nasr City,10,2 months,Ai,"·, Adobe illustrator, Adobe Photoshop, Designer, Graphic Design, graphic designer, Design, Graphic",
Confidential,Senior Frontend Developer,Cairo,10,2 months,Ai,"·, React, CSS3, HTML5, JavaScript",
Confidential,Senior Backend Developer,Cairo,10,2 months,Ai,"·, Node.js, Software Engineering, Software Development, Computer Science",
Royal Class,Technical Lead,Dubai,10,,Ai,"·, Information Technology (IT), Computer Science, Software Development, Computer Engineering, Engineering, Java, Software Engineering",
Etisalat Egypt,Customer Service ( chat account ),Maadi,1,,Web Application Developer,"·, Back Office, Customer Care, Customer Service, Customer Support, Insurance, Medical, .Net",
ICIS,Senior Full Stack Developer .Net + Angular,New Cairo,1,9 days,Web Application Developer,"·, Engineering, Computer Science, Information Technology (IT), Oracle, SQL, Asp.Net, MVC, HTML5",
WUZZUF,Backend Developer,Maadi,1,9 days,Web Application Developer,"·, backend, Computer Science, Information Technology (IT), senior, Software Engineering",
Dayra Market ,Mobile Application Developer,Cairo,1,8 days,Mobile Application Developer,"·, flutter, Firebase",
SalesArm,Senior Mobile Application Developer,New Cairo,1,1 month,Mobile Application Developer,"·, Android, Design, Information Technology (IT), iOS, Swift, UI",
Madar Soft,Customer Support Agent – Mobile Applications,Fleming,1,16 days,Mobile Application Developer,"·, Customer Communication, Conflict Resolution, Customer Care, Customer Service, Customer Support, English, media",
Guestna,Mobile Developer (React Native) - Remote,Cairo,1,14 days,Mobile Application Developer,"·, React Native, iOS, Android, JavaScript",
34ML,Senior Android Developer,Heliopolis,1,11 days,Mobile Application Developer,"·, Android, Information Technology (IT), REST, JSON, Maintenance, Software, Computer Science",
34ML,Senior iOS Developer,Heliopolis,1,11 days,Mobile Application Developer,"·, Information Technology (IT), Objective-C, iOS, OOP",
Spark Systems,Flutter developer (Med: Senior),Sheikh Zayed,1,11 days,Mobile Application Developer,"·, Computer Science, Information Technology (IT), Flutter, RESTful, UI, APIs",
Rizme,Mobile Developer (Flutter),6th of October,1,2 months,Mobile Application Developer,"·, flutter",
Esmart Company,Mobile Application Developer - React Native,Cairo,1,2 months,Mobile Application Developer,"·, Android, iOS, React",
34ML,Vue.Js Frontend Developer,Heliopolis,1,11 days,Mobile Application Developer,"·, Information Technology (IT), REST, Objective-C, Software Design, UI",
SURE International Technology,Senior Android Developer,Nasr City,1,17 days,Mobile Application Developer,"·, Android, Computer Science",
DMJ ,Mobile Application Developer,Sheraton,1,2 months,Mobile Application Developer,"·, Android, APIs, Computer Science, Engineering, Design, Information Technology (IT), Software, iOS",
Naba Soft ,Software Tester,Nasr City,1,19 days,Mobile Application Developer,"·, Information Technology (IT), Quality Control, Software, Software Tester, Software Testing, Tester, Computer Science",
Aldabboos Group    ,Odoo Developer,Sheraton,1,17 days,Mobile Application Developer,"·, Odoo, Python, REST, Software, Information Technology (IT)",
ICON Holding,Senior Design Engineer,Helwan,12,27 days,Data engineer,"·, AutoCAD, Civil, Computer Science, Construction, Information Technology (IT), MS Office, Project",
Confidential,Electrical Maintenance Engineer,Giza,12,25 days,Data engineer,"·, Communication, Electrical",
compsoft,AI & Software Trainer,Giza,12,25 days,Data engineer,"·, Computer Science, Information Technology (IT), Software, Software trainer, AI",
samy ayed group,Agricultural Engineer,Minya,12,28 days,Data engineer,"·, Agricultural, Agriculture, Farms, Irrigation, Management, Operations, Communication, Communication skills",
Zinox&Master,Production Engineer,Obour City,12,1 month,Data engineer,"·, Communication, LEAN, Lean manufacturing, Mechanical, Manufacturing",
UNI Power,Senior Electrical Site Engineer,6th of October,12,2 months,Data engineer,"·, Electrical, AutoCAD, UPS, Batteries",
Moustafa Khater Architects ,Architect - technical engineer,New Cairo,12,28 days,Data engineer,"·, Design Development (DD), Autodesk Revit, Architecture, Autodesk 3ds Max, Navisworks, working drawings, Communication skills, Grasshopper",
BioEnergy,Electrical Engineer,Saf,12,1 month,Data engineer,"·, Power, Automation, Manufacturing, AutoCAD, Communication, Electrical",
Confidential,HSE Engineer,6th of October,12,1 month,Data engineer,"·, HSE, HSE Management, Health, Safety and Environment, Occupational Safety and Health Administration (OSHA), Safety",
Samman  Engineering & Consulting,Sr. Cost Control Engineer ( Mechanical-Electrical-Arc),Dokki,12,1 month,Data engineer,"·, Construction, Cost Control, Electrical, Mechanical",
Confidential,Mechanical Engineer,Nasr City,12,1 month,Data engineer,"·, AutoCAD, CAD, Manufacturing",
Dar El Meyah For Supplies and Contracting,Piping & Mechanical Design Engineer,Sheraton,12,1 month,Data engineer,"·, piping, Mechanical, Design, Water Treatment, Piping Design, AutoCAD 2D",
Aly Arafa,Product Design Engineer,New Cairo,12,1 month,Data engineer,"·, Design, CAD Software, CAD",
Ship & C.R.E.W ,Maintenance Engineer (Containers),Damietta,12,1 month,Data engineer,"·, HVAC, ERP, Maintenance, Mechanical, Leadership, Management",
WebBeds ,Operation Executive (Customer Service Associate) - English Account,Nasr City,10,1 month,Cloud,"·, Customer Service, Operations, Hospitality, Travel, Booking, English, Microsoft Office",
Royal Cyber,Flutter Developer,Riyadh,10,2 months,Cloud,"·, Dart, flutter, Android, iOS, APIs, Flutter Developer, Mobile Development",
ProVision Group,Pre-Sales Engineer,Cairo,10,2 months,Cloud,"·, Engineering, Pre-Sales, Sales Engineering, Software, Communication, Sales",
Dorra Group,System Administrator,Sheikh Zayed,10,1 month,Cloud,"·, Computer Science, CCNA, System Administration, Information Technology (IT), MSCA, Networking, Cisco CCNA",
Epic Systems,AI Engineer – Arabic OCR Specialist,Zamalek,10,2 months,Cloud,"·, Arabic, Computer Science, Engineering, AI, English",
3D Diagnostix,Senior Linux System Admin (+3 years experience),Maadi,10,1 month,Cloud,"·, Linux, System Administration, Information Technology (IT), Network Administration, AWS, Bash, MySQL",
Hestia Dental,Cyber Security Engineer,Cairo,10,2 months,Cloud,"·, Computer Science, Information Technology (IT), Network Security, Engineering, CISSP, CEH, Security, SIEM, Network",
Confidential,Oracle SCM Consultant,Heliopolis,10,2 months,Cloud,"·, Information Technology (IT), Computer Science, Oracle, SCM",
IDA Engineering,BIM Manager,Garden City,10,1 month,Cloud,"·, Design Management, BIM, Revit, Navisworks, BIM Modeling, Revit Dynamo, Grasshopper",
Quanvex,Senior Front-End Developer – React (Remote),New Assuit,10,2 months,Cloud,"·, React, HTML, CSS, JavaScript, Agile, Information Technology (IT), Software Development, Web Design",
ECC Group,System Administrator Team Lead,Nasr City,10,2 months,Cloud,"·, Computer Science, Information Technology (IT), Business Administration, Odoo ERP, Python, Engineering, Network Administration, Administration, Information Systems",
Andersen Tax & Legal ,Senior Web Development Architect & Technical Lead,Heliopolis,10,2 months,Cloud,"·, Web Development, Computer Science, Information Technology (IT), Technical Lead, Software Development, Development, Computer Engineering, wordpress",
WTDD,Backend Developer,6th of October,10,2 months,Cloud,"·, APIs, Node.js, PostgreSQL, MongoDB, OAuth, RBAC, RESTful APIs, GraphQL, backend",
LINK TSP,Senior Flutter developer,New Cairo,10,2 months,Cloud,"·, Java, Android, Software Development, Computer Science, Software, Software Engineering, Information Technology (IT)",
COB Solution ,Data Engineer,Maadi,10,1 month,Cloud,"·, Engineering, Computer Engineering, Computer Science, Data, Data Migration, Development, Python",
Confidential,"Senior Full Stack Developer (.NET core , Angular 8+) Onsite",Nasr City,2,13 days,full stack,"·, Information Technology (IT), Software Development, Software Engineering, OOP, ASP.NET, C#.Net, ADO.NET, SQL",
CM Smart Contracting and consultation,Full Stack Developer,Mokattam,2,21 days,full stack,"·, Computer Science, Information Technology (IT), MySQL, Node.js, React.js, Software Development, Software Engineering, Engineering",
Aria Systems,Senior .Net Full Stack Developer,Maadi,2,14 days,full stack,"·, Information Technology (IT), Telecommunication, Computer Science, .NET, .NET Development, Angular, CSS, HTML5",
Nacita,Full-stack Software Engineer,Cairo,2,21 days,full stack,"·, software engineeer, angular, Agile, Java, nodejs, Kubernetes, Google Cloud",
Ultimate Solutions Egypt,Senior Full Stack Developer,Sheikh Zayed,2,19 days,full stack,"·, Angular, API, Computer Science, Design, CSS3, Development, Docker",
Yodawy Med,Junior Full Stack Developer,Mohandessin,2,22 days,full stack,"·, Computer Science, Engineering, Software Development, Software Engineering, JavaScript",
HIGHBASE TRADING W.L.L,Senior Full Stack PHP Laravel Developer (Remote - Full Time),Cairo,2,18 days,full stack,"·, PHP, HTML5, CSS3, Laravel, MySQL, Vue.js, Tailwind, Front-End Development",
Babeleye,Full Stack Developer,Maadi,2,18 days,full stack,"·, Computer Science, Engineering, Software Development, Software Engineering, Information Technology (IT), Software, Laravel, jQuery",
Biobusiness,.NET Full Stack Developer,Hadayek Alahram,2,24 days,full stack,"·, .Net, Angular",
Confidential,Remote Senior Full-Stack Developer,Cairo,2,21 days,full stack,"·, shopify, liquid, react, vue.js, html5, MySQL, JavaScript, Figma",
My Business Care Team,Senior Developer/Manager (Full-Stack + ML Ops),Cairo,2,23 days,full stack,"·, AWS, Information Technology (IT), Software, Software Development, DevOps, Cloud, Lambda, EC2, DynamoDB",
Confidential,Dot Net Senior Full Stack Developer,Nasr City,2,24 days,full stack,"·, HTML, Angular, DotNet, Java, Information Technology (IT), JavaScript, REST",
BI-Technologies,Full stack Developer (.Net Core & Angular),New Cairo,2,24 days,full stack,"·, ASP.NET, Software Development, .NET, Information Technology (IT), Computer Science, Computer Engineering, Database Design, Data Modeling",
Confidential,Full Stack Team Lead,Dubai,2,22 days,full stack,"·, Azure, back-end, Development, Information Technology (IT), Cloud, HTML, Computer Science, CSS, Java",
Confidential,Full stack developer [PHP - Laravel],New Cairo,2,25 days,full stack,"·, Computer Science, Software Development, Information Technology (IT), Software Engineering, PHP, Python, Software",
Orchidia Pharmaceutical Industries,Sales Analyst,Obour City,2,21 days,Data Analyst,"·, Microsoft Excel, Microsoft Office, CRM, Analysis, analytical, Sales Analysis",
Transmar International ,Market Research Analyst,Cairo,2,22 days,Data Analyst,"·, Analysis, Market Research, Research, Microsoft Excel, Finance, Economics",
Nile Projects & Trading,Real Time Analyst,Alexandria,2,22 days,Data Analyst,"·, Call Center, Customer Service, Information Technology (IT), Microsoft Office, Operations, Real Time Management",
Fine Hygienic Holding,Sales Analyst - Power BI,6th of October,2,,Data Analyst,"·, Analysis, Sales Analysis, Finance, Power BI, SQL",
eClerx ,MIS Analyst,Maadi,2,,Data Analyst,"·, Analysis, MIS, Reporting, Tableau",
