company_name,job_title,location,page_number,posted_time,search_keyword,technologies,years_of_experience
CodeCooks,Full Stack Developer,New Cairo,9,17 days,Data Analyst,"·, Full Stack Developer, Information Technology (IT), Computer Science, Software Development, Full Stack",
Module ,Social Media Manager,6th of October,9,16 days,Data Analyst,"·, E-Marketing, Marketing, platforms, Social Media, social media management, Creative, media",
metco,Technical Office Engineer,Cairo,9,2 months,Mobile Application Developer,"·, Engineering, Information Technology (IT), Technical Support, Cisco, Communication, Computer Science, Help desk, Linux",
Khales,Technical Project Manager,6th of October,9,2 months,Mobile Application Developer,"·, Communication skills, Computer Science, Engineering, PMP, Project, Project Management, Planning, English",
SevenRooms,Account Manager,Dubai,9,,Mobile Application Developer,"·, Sales, Sales Skills, Customer Service, Sales Target, Customer Support, Customer Care, Account Management",
Citylogix ME  ,GIS Technician,New Cairo,9,2 months,Mobile Application Developer,"·, Arc GIS, GIS, QGIS",
Confidential,UI UX Designer,Giza,9,2 months,Mobile Application Developer,"·, Communication skills, Software, Adobe illustrator, Adobe Photoshop, Computer Engineering, Computer Science, Design",
Arcelormittal Egypt,IT technical support specialist,Cairo,9,2 months,Mobile Application Developer,"·, Information Technology (IT), Linux, Software, technical, Technical Support, Cisco, computer",
Efada Technology,"Senior System Engineer ""Infrastructure""",New Cairo,9,2 months,Mobile Application Developer,"·, Automation, Azure, Cloud, Computer Engineering, Active Directory, Engineering, Information Technology (IT), Infrastructure, SQL",
Snap Inc.,Client Partner,Riyadh,9,,Mobile Application Developer,"·, sales, sales skills, information technology (it), customer service, marketing, social media, media",
CACI International Inc,Master HVAC Technician - TS/SCI,Riyadh,9,,Mobile Application Developer,"·, hvac, engineering, mechanical engineering, autocad, maintenance, design, management",
Creative Motion,Odoo Developer,Maadi,20,,Data engineer,"·, CSS, Odoo Development, Information Technology (IT), Computer Science, Python, Communication skills, Development",
Almosafer,Manager - Data Intelligence Analyst,Mohandessin,20,2 months,Data engineer,"·, Power BI, Quicksight, Tableau, Genesys, LiveEngage, SQL, Microsoft Office",
Guestna,Software Development Manager - Remote (Full Time / Part Time),Riyadh,20,14 days,Data engineer,"·, Computer Science, Software Development, DevOps, Development, APIs, Agile, Information Technology (IT), Software",
Bright Creations,DAZU - Python Developer (FinTech),Smart Village,20,,Data engineer,"·, Python, Django, Flask, Python Scripting, Web Scraping, WWeb Scraping, CI, Computer Science",
DE.CI,Production Engineer,15th May City,20,2 months,Data engineer,"·, Furniture, Microsoft Office, Production, Maintenance, Furniture Production, Manufacturing",
Intertrade Co. ,Production Chemist,10th of Ramadan City,20,23 days,Data engineer,"·, Chemistry, quality, Communication skills, Microsoft Excel, Science, Testing",
Kgroup,Fleet Manager,Nasr City,20,14 days,Data engineer,"·, Fleet Management, Fleet, Logistics, gps, Maintenance, Management",
Outservingplus,Chief Surveying,Abu Qir,20,,Data engineer,"·, AutoCAD 2D, Construction, English",
CSCEC Egypt,Survey Engineer,Cairo,20,2 months,Data engineer,"·, CAD, AutoCAD, Surveying",
Vceram,Sales Engineer 3Dprinter.,Giza,20,2 months,Data engineer,"·, Communication skills, AutoCAD, Design, English, sales skills, Sales, Sales Target",
Confidential,Routing Specialist,Mohandessin,20,15 days,Data engineer,"·, Routing, Routing Specialist, GIS Application, Sales Buzz, Computer Science, Information Technology (IT)",
WUZZUF,Backend Developer,Maadi,20,9 days,Data engineer,"·, backend, Backend developer, Computer Science, developer, Information Technology (IT), Software Development, senior",
National Technology,Oracle Developer,Nasr City,20,22 days,Data engineer,"·, Oracle, Oracle Database, Oracle Application, Oracle Development, Information Technology (IT), Web Development, Computer Science, Oracle Forms",
Seoudi Supermarket,Network Security Administrator,Sheikh Zayed,20,,Data engineer,"·, CCNA, Computer Science, firewalls, Information Technology (IT), network, Network Administration, Networking",
MM contracting and supplying ,Technical Office Engineer -Quantity Surveying,Cairo,20,2 months,Data engineer,"·, Architecture, AutoCAD, Civil, Construction, Electrical, Mechanical",
Alshaya,Manager - Social Listening,Cairo,10,23 days,Data Analyst,"·, Social Media, Social Listening, Digital Marketing, Customer Retention, Analysis",
The German-Arab Chamber of Industry and Commerce ,Head of Business & Market Entry,Mohandessin,10,9 days,Data Analyst,"·, Market Research, Economics, Business Development, Networking, German",
Decorative Glass And Arab Union Glass Group,Financial Auditor,Obour City,10,22 days,Data Analyst,"·, Auditing, ERP, accountant, Accounting, Accounting Software, analytical, auditor, Finance, Financial Analysis",
Confidential,Tax Accountant,New Cairo,10,23 days,Data Analyst,"·, Accounting, Financial Analysis, Finance, Tax",
FinBi Finance & Banking Consultants International,Vice President,Dokki,10,21 days,Data Analyst,"·, Finance, Analytical Skills, Investment, Economics, Presentation Skills",
Confidential,Cost Accountant,6th of October,10,15 days,Data Analyst,"·, Accounting, Cost Accounting, English, Finance, Financial Analysis, MS",
LCM North Africa Middle East,R&D Formulation Specialist,10th of Ramadan City,10,23 days,Data Analyst,"·, Science, Chemist, Research, Pharmacy, Chemistry, Communication, Communication skills",
Confidential,Salesforce Developer,Zamalek,10,21 days,Data Analyst,"·, APEX, lightning, Salesforce, Visualforce",
Egypt Teda,Real Estate Agent,Ataqah,10,25 days,Data Analyst,"·, Communication, analytical, Customer Care, Customer Service, Management, Marketing, Operations",
Technical Co For Engineering and Feeding Industries,Financial Manager,Obour City,10,2 months,Data Analyst,"·, Financial Management, Financial Analysis, Accounting, CPA, CFA, Financial Statistics, ERP, Budgeting",
Kandil Industries,Cost Accountant,Nasr City,10,1 month,Data Analyst,"·, Accounting, Cost Accountant, Cost, Cost Accounting, Financial Analysis",
Samman  Engineering & Consulting,Sr. Cost Control Engineer ( Mechanical-Electrical-Arc),Dokki,10,1 month,Data Analyst,"·, Civil Engineering, Construction, Cost Control, Electrical, Engineering, Mechanical, Architectural Engineering",
BI-Technologies,Senior Power BI Developer,New Cairo,10,2 months,Data Analyst,"·, Computer Science, Power BI, SSRS, BI, SQL, Microsoft Power BI, Engineering",
AFI FOOD,Cost Accountant,Obour City,10,1 month,Data Analyst,"·, Financial Analysis, Cost Accountant, Accounting, Finance",
Abaya Noir,Cost Accountant,Shubra Alkhaymah,10,1 month,Data Analyst,"·, Cost Accountant, Finance, accountant, Accounting",
Wadi Group,Project Manager,Aswan,21,,Data engineer,"·, Computer Science, Experience, Information Technology (IT), Managing, Planning, Project Management",
SURE International Technology,Senior Software Quality Control Engineer,Nasr City,21,2 months,Data engineer,"·, Computer Science, Quality Control, Analytical Skills, Control, Software Testing",
CLS Learning Solutions,Sales Executives - Tech Training Sector,Cairo,21,,Data engineer,"·, Sales Target, Sales, sales skills, Career Advising, Sales Training, business, Communication, Communication skills",
Gila Electric,Electrical Planning Manager,10th of Ramadan City,21,,Data engineer,"·, Electrical, Planning, Manager, Manufacturing, Communication, demand",
Itechs Group,IT Project Manager,Heliopolis,21,,Data engineer,"·, ms project, ERP, IT, Project Management",
Al Ateeq Software,Senior Front End Developer,Heliopolis,21,,Data engineer,"·, Angular, Communication skills, Computer Science, front-end, Information Technology (IT), UI/UX, Development",
Global Food Investment,Farm Manager,10th of Ramadan City,21,11 days,Data engineer,"·, Agricultural, Agriculture, Science, farm",
Kandil Glass ,Process Improvement Engineer,10th of Ramadan City,21,2 months,Data engineer,"·, Lean, Six Sigma, process improvement methodologies., Strong analytical and problem, solving skills, Excellent communication and teamwork abilities.",
Aayan Developments,IT Specialist,New Cairo,21,18 days,Data engineer,"·, Computer Systems, Installation, Information Technology (IT), networks, IT, Technical Support, Software, Communication",
El Mansour Development ,Technical Office Electrical Engineer . QS,Mokattam,21,2 months,Data engineer,"·, Electrical, QS, TO",
Craftsman SFZ,BIM Architect,Salalah,21,,Data engineer,"·, Revit, Architecture, Drawings, BIM, BIM Modeling, Revit BIM",
Hamza Group,Operations Manager,6th of October,21,8 days,Data engineer,"·, Maintenance, Manufacturing, Operations, Operations Management, Planning, Production, Communication skills",
Conversion MEP,Mechanical Designer,Cairo,21,12 days,Data engineer,"·, AutoCAD, 2D, Mechanical, HVAC, 3D, CAM",
Pharma Overseas ,IT Compliance Auditor,Cairo,21,14 days,Data engineer,"·, Computer Science, Information Technology (IT), IT",
Turnkey trading & Contracting,Safety Officer,Downtown,21,18 days,Data engineer,"·, Health and Safety, quality, Safety Management, Safety, Quality Assurance",
ESLSCA University,Research Assistant,6th of October,11,1 month,Data Analyst,"·, research assistant, reseach, assistant",
Aries Consult Ltd.,Field Researchers – Policy Development & Implementation,Cairo,11,1 month,Data Analyst,"·, Gender, Puplic Policy, Energy policy and energy transition, Education, Rule of Law, Control of Corruption, Transparency and Accountability",
Confidential,Product Owner,Dokki,11,1 month,Data Analyst,"·, Business Analysis, Scrum, Management",
AppsTec,OFSAA Consultant,Cairo,11,1 month,Data Analyst,"·, OFSAA, PLSQL, TSQL, Banking, Power BI",
Ship & C.R.E.W ,Pricing Specialist,Glim,11,1 month,Data Analyst,"·, Communication, Logistics, Pricing, Operations, Transportation",
AL SALMANYA,Cost Accountant,Cairo,11,1 month,Data Analyst,"·, accountant, Accounting, analytical, Cost, Cost Accounting, Finance, Financial Analysis",
GMC,Senior Cost Accountant,Maadi,11,1 month,Data Analyst,"·, Accounting, accountant, Financial Management, Cost Accountant, excel, Cost, Finance, Management, MS",
HITS Solutions,Bioinformatician (Proteomics & Drug design),Nasr City,11,1 month,Data Analyst,"·, Research Analysis, Computer Science, Drug Development, Drug Design, Proteomics, Biotechnology, Documentation",
Easy Group For Health and Beauty Care,Financial Planning And Analysis Head,Alexandria,11,1 month,Data Analyst,"·, Accounting, Analysis, Computer Skills, English, excel, Finance, Financial",
International Food & Consumable Goods Egypt S.A.E,Cost Accountant,6th of October,11,2 months,Data Analyst,"·, FMCG, Cost Accounting, Finance, ERP, Cost Control, Cost, Project Cost Control, Cost Management",
Dwell Egypt,Full Stack Developer,New Cairo,11,1 month,Data Analyst,"·, Real Estate, Computer Science, Information Technology (IT), Software, Java",
Osus Group ,Software Tester - Fully Remote Job,Cairo,11,1 month,Data Analyst,"·, Quality Assurance, International Software Testing Qualifications Board, Software Testing, System Testing, Testing, Automation Testing, User Testing",
Ghataty,Inventory Analysis,6th of October,11,2 months,Data Analyst,"·, Financial Analysis, Finance, Communication skills, inventory, Management, Stock Control, Financial Management",
Holw El Sham,Cost Accountant Section Head,6th of October,11,2 months,Data Analyst,"·, Accounting, Cost Accountant, Financial Analysis, Financial Management",
Etoile,Cost control Manager,Shubra,11,2 months,Data Analyst,"·, Accounting, Analysis, ERP, Finance, Financial Analysis, Cost Analysis, Cost Management",
TIC,Procurement & Tendering Engineer,Cairo,22,2 months,Data engineer,"·, Civil, Architecture, Mechanical, Microsoft Office, Procurement, Tendering",
Sky Elite,Computer science instructor,Dammam,22,8 days,Data engineer,"·, Computer Science, Computer Skills, Teaching, Information Technology (IT), Software Development, computer, Design, Science",
Option Travel,Maintenance Manager,Maadi,22,8 days,Data engineer,"·, Fleet, Maintenance, Mechanical, Repair, Safety",
S G D,Civil Site Engineer,Alamein,22,2 months,Data engineer,"·, Civil, Site",
Babeleye,Full Stack Developer,Maadi,22,18 days,Data engineer,"·, Computer Science, Software Development, Information Technology (IT), Software, Laravel, jQuery",
Goldentex,Costing Section-Head,10th of Ramadan City,22,,Data engineer,"·, Cost, Control, Cost Accounting, Cost Control, Accounting, Finance, English, Management",
GMC,Forensic Delay Analyst,Cairo,22,21 days,Data engineer,"·, Construction, Project Management, Porject, Scheduling, Analyst",
CM Smart Contracting and consultation,Full Stack Developer,Mokattam,22,21 days,Data engineer,"·, Computer Science, Full Stack, Information Technology (IT), MySQL, Node.js, React.js, Software Development",
Al-Nasser ,Planning Section Head ( Garment Factory ),Fayoum,22,14 days,Data engineer,"·, Communication, Production, Planning, Production Planning, Manufacturing",
Condor Electronics,Quality Manager – Home & Electrical Appliances,6th of October,22,14 days,Data engineer,"·, Quality Assurance, Communication skills, ISO 9001, ISO, quality, Quality Control, Quality Management, Six Sigma",
Q Design,Electrical Design Team Leader,Maadi,22,15 days,Data engineer,"·, Design, Electrical, Electrical Design, Computer Science, Information Technology (IT), Revit",
GNS,Presales Engineer – Automation – Cairo Office,Maadi,22,2 months,Data engineer,"·, Automation, Microsoft Office, Presales, Communication, AutoCAD",
Si-Vision,Quality Assurance,Sheraton,22,21 days,Data engineer,"·, ISO 9001, ISO, Management, QA, quality, Quality Assurance, Quality Control, Quality Management",
Outservingplus,Mechanical Maintenance Engineer,Katameya,22,2 months,Data engineer,"·, Maintenance, FMCG, Mechanical",
Eagle Chemicals,Research & Technology (R&T) Chemist,6th of October,12,2 months,Data Analyst,"·, Chemistry, Development, research and development, Research, Science, quality, Analysis",
Royal Cement,Planning Specialist,Sheraton,12,2 months,Data Analyst,"·, Planning, Supply Chain, Operations Management, SAP, Power BI, Microsoft Office 365, Microsoft Excel",
Cegy plastics ,Cost Accountant,10th of Ramadan City,12,2 months,Data Analyst,"·, accountant, Accounting, Accounting Software, analytical, Cost, Cost Accountant, Cost Accounting, excel, Finance",
Macro Group,Cost Accountant,Sheraton,12,2 months,Data Analyst,"·, Cost Accountant, Cost Accounting, Cost, Finance, Accounting, accountant, Accounting Software, Oracle, oracel fusion",
El Banna Group Company,Tax Accountant,10th of Ramadan City,12,2 months,Data Analyst,"·, accountant, Accounting, Accounting Software, Finance, Financial Analysis, Tax, tax accountant, Software",
BI-Technologies,Application Consultant (Sales Buzz Product),New Cairo,12,2 months,Data Analyst,"·, Information Technology (IT), Computer Science, Engineering, Telecommunication, Telecom Engineering, Software, Software Implementation",
NILEWOOD ,Budgeting & Reporting Section Head,Agouza,12,2 months,Data Analyst,"·, Accounting, Budgeting, CMA, ERP, Finance, Financial Management, Manufacturing, Oracle",
Confidential,Civil or Architect Engineer for feasibility studies,Nozha,12,2 months,Data Analyst,"·, Engineering, Feasibility, Real Estate",
Memaar Alashraaf,Tax Accountant,New Cairo,12,2 months,Data Analyst,"·, accountant, Accounting, Accounting Software, Finance, Financial Analysis, tax accountant, Tax, CMA",
Rehabitaire,MERN Stack Developer,Maadi,12,2 months,Data Analyst,"·, Computer Science, Engineering, HTML5, Information Technology (IT), JavaScript, MongoDB, React",
Egypt Teda,Assets Management Specialist,Ataqah,12,2 months,Data Analyst,"·, Communication, analytical, Customer Care, Customer Service, Management, Marketing, Operations",
Roya Developments,Senior Investment & Portfolio Management,Sheraton,12,2 months,Data Analyst,"·, Analysis, Financial Analysis, Finance, Investment, Portfolio Management, Economics",
Eamar Al Delta ,Receivable Accountant,New Cairo,12,2 months,Data Analyst,"·, Accounting, MS Excel, Real Estate, MS, Reporting, excel, Finance",
Kidana | كدانة,Sr. Specialist - Business Performance,Makkah,12,,Data Analyst,"·, Human Resources (HR), Recruitment, Communication Skills, English, Sales, Business Development, Customer Service",
Knight Frank,Senior Manager - Capital Markets,Riyadh,12,,Data Analyst,"·, Sales, Sales Skills, Customer Service, Project Management, Marketing, Information Technology (IT), Customer Support",
Egyptian German Automotive,Paint Shop Quality Control Engineer,6th of October,23,2 months,Data engineer,"·, Automotive, Chemical, Communication, Chemistry, quality, Quality Control",
ITIDA,CRM technical Lead,Smart Village,23,25 days,Data engineer,"·, Communication, Communication skills, Computer Science, CRM, Development, Information Technology (IT)",
Masar Architects ,Technical Architect,New Cairo,23,14 days,Data engineer,"·, AutoCAD, Architecture, Revit, English, CAD, AutoCAD Architecture",
engineering tracks,Senior social media,Nasr City,23,14 days,Data engineer,"·, Business Development, Communication, Communication skills, Negotiation, Advertising, campaigns",
AL SALMANYA,Architect Site Engineer,Cairo,23,2 months,Data engineer,"·, Architect, Architecture, AutoCAD, Site",
Egyptian Packaging and Plastic Systems Corp,Supply Chain ( Procurement / Foreign Logistics ),Manial,23,15 days,Data engineer,"·, Administration, Business Administration, Logistics, Operations, Procurement, Shipping, Suppliers",
brmja tech,Backend Developer,Faisal,23,15 days,Data engineer,"·, Backend developer, Laravel, PHP, Mysql Database, Computer Programs, Computer Science, Information Technology (IT), Microsoft Programs, SQL",
Cultiv,IoT/PCB Lab Specialist - ASSUIT,New Assuit,23,15 days,Data engineer,"·, EAGLE, Altium, Proteus, C, Electronics, Embedded Systems, Hardware, IOT",
Cultiv,IoT /PCB Lab Specialist - BORG,Bourj Alarab,23,15 days,Data engineer,"·, EAGLE, Altium, Proteus, Embedded Systems, Hardware, IOT, PCB, Python",
MM contracting and supplying ,Technical Office Engineer -Electrical,Cairo,23,2 months,Data engineer,"·, AutoCAD, Communication, Design, Electrical, Manufacturing",
Monglish Academy,Backend Developer,Alexandria,23,16 days,Data engineer,"·, back-end, Computer Science, Information Technology (IT), Software",
Seoudi Supermarket,Senior Devops Engineer,Sheikh Zayed,23,2 months,Data engineer,"·, Information Technology (IT), Linux, Python, Software, Software Development, Git",
IKK GROUP (KCGABUILD),Accountant,Cairo,23,21 days,Data engineer,"·, Accounting, Construction, English, ERP, excel, Finance, Financial, Financial Analysis",
"Telecom Systems Provider, LLC",Backend Developer,Maadi,23,24 days,Data engineer,"·, CI/CD, Android, Computer Science, Software, iOS, REST, Development, Information Technology (IT)",
Confidential,Civil or Architect Engineer for feasibility studies,Nozha,23,2 months,Data engineer,"·, Feasibility, Real Estate",
TECTRA,Architectural Technical Office Engineer,New Cairo,24,2 months,Data engineer,"·, Architecture, Microsoft Office, BOQ, Technical Office, Quantity Surveying, Shop Drawings, AutoCAD",
Arab Mechanical Engineers ,Sales Engineer/Specialist,Nasr City,24,2 months,Data engineer,"·, Applied Arts, AutoCAD, Design, English, Furniture, Interior Design, Negotiation, Sales",
Universities of Canada in Egypt,Senior Network & Security Engineer,New Capital,24,2 months,Data engineer,"·, CCNA, CCNP, Cisco, Computer Science, Information Technology (IT)",
Confidential,IT Help Desk,Qalubia,24,19 days,Data engineer,"·, Computer Science, Help desk, Information Technology (IT), Installation, IT Help Desk, IT, Microsoft",
Orchid For Trading & Industry,Sales Engineer,Cairo,24,2 months,Data engineer,"·, Sales, Sales Target, Communication, Technical Sales, sales skills",
GB Corp,Warranty Engineer,Cairo,24,2 months,Data engineer,"·, Warranty, Automotive",
Yodawy Med,Junior Full Stack Developer,Mohandessin,24,22 days,Data engineer,"·, Computer Science, Full Stack, Software Development, JavaScript",
Roots Group ,Production Engineer,Sharqia,24,2 months,Data engineer,"·, Manufacturing, Production, Production Processes",
Olam SVI,Quality Control Supervisor,6th of October,24,18 days,Data engineer,"·, Chemistry, Communication, GMP, Manufacturing, Production, quality",
engineering tracks,Senior Media Buyer,Nasr City,24,21 days,Data engineer,"·, Business Development, Communication, Communication skills, Negotiation, Advertising, campaigns",
Nexus Tech Support  ,System Engineer,New Cairo,24,2 months,Data engineer,"·, Computer Science, Information Technology (IT), system",
Selah ElTelmeez For Publishing & printing,HVAC Maintenance Supervisor,Obour City,24,24 days,Data engineer,"·, HVAC, HVAC Systems, Air Conditioning, Mechanical, Maintenance, analytical",
Erada,Junior Process Excellence and PMO,Maadi,24,24 days,Data engineer,"·, Quality Assurance, Quality Management System, Customer Support, Finance, Telecommunication, Telecom",
Style Home Development,Civil Engineer,New Cairo,24,2 months,Data engineer,"·, AutoCAD, Microsoft Office, Communication, Site",
Sphinx Glass,Procurement Specialist,Alsadat City,24,23 days,Data engineer,"·, Purchasing, Procurement, ERP, Industrial, Manufacturing, Supply Chain, Computer Skills",
In House,Chief Technology Officer,Mohandessin,25,23 days,Data engineer,"·, CTO, Information Technology (IT)",
Elgabaly Architects,Junior Architect - ( Working Drawings & Revit ),New Cairo,25,23 days,Data engineer,"·, Architecture, Sketch Up, CAD, Revit, Drafting, Design, Drawing",
GlassRock Insulation Co.,Quality Control Chemist,Alsadat City,25,23 days,Data engineer,"·, quality, Quality Assurance, Quality Control, Science",
Makeplace Developments,Senior Projects Control Engineer,New Cairo,25,2 months,Data engineer,"·, Construction, Project Management, Primavera P6, Primavera, P6, Planning, Construction Project Management",
Logistica,HSE Assistant Manager - Fayoum Site,Fayoum,25,24 days,Data engineer,"·, Nebosh, Lead Auditor, International Standards, Health and Safety, ISO 22000:2018, ISO 14001, ISO 45001, NFSA, food safety regulations",
Sphinx Glass,Area Sales Manager (Experienced Non-Manger Position),Maadi,25,28 days,Data engineer,"·, Customer Service, Communication, English, Negotiation, Presentation Skills, Sales Target, sales skills",
ITIDA,Training Operations Lead,Smart Village,25,25 days,Data engineer,"·, Management, IT, Training",
NILEWOOD ,Junior Production Chemist,Alsadat City,25,25 days,Data engineer,"·, Production, Science, Chemistry",
"Nile Bits, LLC",Senior Salesforce Developer,6th of October,25,27 days,Data engineer,"·, Computer Science, Software Development, AWS, business, Communication, Information Technology (IT), Integration, Salesforce",
Fixed Solutions,Pen Tester- Cyber Security Engineer L1,Cairo,25,2 months,Data engineer,"·, Cybersecurity, Mobile Development, JIRA, Java, Penetration Testing, ASP.Net, Software Development, Vulnerability Scanning",
Experts,Tender & Procurement Mechanical Engineer,Heliopolis,25,2 months,Data engineer,"·, Revit MEP, CAD Software, Tendering, Procurements, Negotiation",
Royal Cement,Procurement Engineer,Nozha,25,2 months,Data engineer,"·, Mechanical, Negotiation, Electrical, Communication, Procurement, Purchasing",
DOT Information Technology,Senior Data Scientist,New Cairo,25,2 months,Data engineer,"·, Machine Learning, Information Technology (IT), Programming, NLP",
Energya Steel Fabrication- Elsweedy Helal,Planning Manager – Steel Industry,10th of Ramadan City,25,28 days,Data engineer,"·, ERP, Industrial, Manufacturing, Management, Project Management",
Ertekaa,Fleet Manager,Sayeda Zeinab,26,28 days,Data engineer,"·, Fleet Management, Fleet, FLEET MANAGER, Vehicles, Trucks, Mechanical",
Venus Hiring,Data Analyst,Toronto,26,2 months,Data engineer,"·, Analysis, analytical, Computer Science, Information Technology (IT), SQL",
Energya Steel Fabrication- Elsweedy Helal,Purchasing Manager - Steel Industry,10th of Ramadan City,26,28 days,Data engineer,"·, ERP, Logistics, Procurement, Purchasing, Supply, Supply Chain, Steel Industry",
United to End Cervical Cancer in Egypt,Senior Project Manager,Cairo,26,30 days,Data engineer,"·, Management, MS Office, Project, Project Management, Social Media, Analysis, media, Computer Science, Financial Management",
Alex Apparels for Garment Manufacturing,Senior Industrial Engineer (IE),Ameria,26,2 months,Data engineer,"·, Communication, Computer Science, Industrial, Manufacturing, Planning",
Global Brands,Pre-Sales Active Network Engineer,New Cairo,26,2 months,Data engineer,"·, Presales, Microsoft Office, Information Technology (IT), Sales, technical, Communication",
Cosmos,Senior Site Mechanical Engineer,Marsa Matruh,26,2 months,Data engineer,"·, HVAC, Plumbing, Firefighting",
AlGammal Contracting,Quality Control Engineer,Abu Rawash,26,2 months,Data engineer,"·, Control, quality, Quality Assurance, Quality Control",
Pro Light Egypt,Electrical Sales Engineer/ Projects Sales (Lighting Field ),6th of October,26,2 months,Data engineer,"·, Lighting, Sales, Negotiation, LED Lighting, Lightroom",
ECC Group,Data Management Specialist,Nasr City,26,2 months,Data engineer,"·, Administration, Communication, CRM, Digital Marketing, Management, Microsoft Excel",
Efada Technology,"Senior System Engineer ""Infrastructure""",New Cairo,26,2 months,Data engineer,"·, Automation, Azure, Cloud, Active Directory, Information Technology (IT), Infrastructure, SQL",
