company_name,job_title,location,page_number,posted_time,search_keyword,technologies,years_of_experience
Dynamicslink,"Talent Acquisition Specialist – IT, Software Sector",Nasr City,1,,software,"·, Human Resources (HR), Recruitment, Talent acquisition, IT, Recruiter, English",
softprograms,Software Sales Account Manager,Nasr City,1,,software,"·, Communication skills, Sales Planning, Technical Presentations, Contract Negotiation, CRM, Sales Skills, Business Administration",
Rashideen Egypt for Trade ,Software developer,Katameya,1,,software,"·, API, CSS, Engineering, HTML, Web API",
Gila Electric,Senior Software Developer,Cairo,1,,software,"·, Design, Engineering, Agile, Computer Science, Git, Information Technology (IT), Python",
Link Development,Software Engineering Lead – Dynamics 365 CRM and Power Platform,Maadi,1,,software,"·, Microsoft Dynamics CRM, Dynamics 365, MS Dynamics 365, Microsoft Power BI, .Net, CRM, English",
Lumin,Commercial Director - Experience in Software,Sheikh Zayed,1,,software,"·, Sales, IT, Business Development, Commercial Sales, Commercial",
Roaya,Sales Software Account Manager,Maadi,1,,software,"·, Computer Science, Customer Service, Engineering, Sales, Sales Target, IT, sales skills",
Bright Creations,Software Tester - Quality Control,Smart Village,1,,software,"·, Computer Science, Information Technology (IT), Testing Applications, JIRA, TestLink, TestDirector",
BDO Esnad,Software Developer,Maadi,1,,software,"·, Reporting",
Bevatel,Senior Software Sales Specialist,Dokki,1,8 days,software,"·, CRM, sales skills, Negotiation, negotiation skills, Information Technology (IT), IT, Sales",
Itechs Group,Software Engineer (Frontend),Nasr City,1,,software,"·, CSS3, Git, HTML5, JavaScript, Redux, RESTful, Information Technology (IT)",
Softec Technologies,Software Application Support Engineer,Maadi,1,9 days,software,"·, Engineering, Technical Support, Information Technology (IT), Computer Science, Troubleshooting, Networking, English",
Itechs Group,Software Engineer (Backend),Nasr City,1,,software,"·, MySQL, MongoDB, JavaScript, PostgreSQL, presentation skills, communication skills",
Quanvex,Software Sales Rep,Sheikh Zayed,1,10 days,software,"·, sales skills, CRM, Information Technology (IT), IT, Sales",
Lecico Egypt,BI software adminstrator,Alexandria,1,,software,"·, BI, Computer Science, Data Science, Information Technology (IT)",
Bright Creations,DAZU - Python Developer (FinTech),Smart Village,1,,python,"·, Django, Flask, Web Scraping, WWeb Scraping, CI, Computer Science",
Softxpert Incorporation ,Senior Python Developer,Bolkly,1,22 days,python,"·, APIs, Angular, Software Development, Software Engineering, Web Development, MySQL",
Softec Technologies,Python Team Lead - AI & Python Engineering,Cairo,1,23 days,python,"·, API, AWS, Communication skills, Computer Science, Development, Docker, Engineering",
Luxoft (A DXC Technology Company),Python Automation Engineer,Cairo,1,2 months,python,"·, API, Computer Science, Information Technology (IT), JIRA, Selenium, Software Development, Testing",
Luxoft (A DXC Technology Company),Senior Python Automation Engineer,Cairo,1,2 months,python,"·, ALM, API, API Testing, Information Technology (IT), Git, Computer Science, Development, JIRA",
Gila Electric,Senior Software Developer,Cairo,1,,python,"·, Design, Software Development, Engineering, Agile, Computer Science, Git, Information Technology (IT)",
WUZZUF,Data Analysis Manager,Maadi,1,9 days,python,"·, Analysis, business, Computer Engineering, Computer Science, Data Analysis, Engineering, Microsoft Excel",
Code SA Ltd,Senior Software Engineer,Cambridge,1,10 days,python,"·, APIs, Docker, React.js, Flask, FastAPI, Django, Software Development",
Creative Motion,Odoo Developer,Maadi,1,,python,"·, CSS, Odoo Development, Information Technology (IT), Computer Science, Communication skills, Development, Engineering",
HYVE Technology Consulting ,Tech Lead Data Engineering,Nasr City,1,,python,"·, Computer Engineering, Data, Data Analysis, ETL, Hadoop, Relational Databases, SQL, IBM DataStage",
HYVE Technology Consulting ,Data Engineer,Cairo,1,,python,"·, Computer Engineering, Computer Science, Data Mining, Data, Database, Engineering, Ibm, Information Technology (IT)",
HYVE Technology Consulting ,Data Scientist,Cairo,1,,python,"·, Computer Science, Data, Data Science, data scientist, Engineering, Hadoop, Information Technology (IT), Java",
Pure Group ,AI Engineer,Cairo,1,,python,"·, AI, LMS, FFT, Engineering, Frameworks, PyTorch, TensorFlow, NLP",
Alshaya,Senior Manager - Data Analytics,Nasr City,1,,python,"·, Data Analytics, CRM, Quantitative Research, Commercial Analysis, Performance Measurement, Loyalty Programme, Performance Analytics, Loyalty Programme Analytics",
DARKNESSIA,Odoo Developer,6th of October,1,,python,"·, Computer Science, Development, Odoo, Programming, Information Technology (IT), Odoo Development",
Bright Creations,Backend Developer (Laravel),Smart Village,1,,backend,"·, Engineering, APIs, Laravel, PHP, Full Stack Development, Computer Science, Information Technology (IT)",
bluworks ,Senior Backend Developer,Maadi,1,,backend,"·, Software Development, Software Engineering",
Devency  ,Backend Engineer,Nozha,1,12 days,backend,"·, Software Development, Engineering, Typescript, Node.js, NoSQL, SQL, Software Engineering",
Itechs Group,Software Engineer (Backend),Nasr City,1,,backend,"·, MySQL, MongoDB, JavaScript, PostgreSQL, Software Engineering, Software Development, presentation skills, communication skills",
WUZZUF,Backend Developer,Maadi,1,9 days,backend,"·, Computer Science, developer, Information Technology (IT), Software Development, senior, Software Engineering",
Spark Systems,Back-end .NET Core Developer,Sheikh Zayed,1,17 days,backend,"·, .Net, .net core, ASP, ASP.Net, Information Technology (IT), Software Development, Computer Science, Software Engineering",
brmja tech,Backend Developer,Faisal,1,15 days,backend,"·, Laravel, PHP, Mysql Database, Computer Programs, Computer Science, Information Technology (IT), Microsoft Programs, SQL",
Monglish Academy,Backend Developer,Alexandria,1,16 days,backend,"·, Computer Science, Information Technology (IT), Engineering, Software",
CompactSoft International ,Software Developer .NET (Backoffice / Backend),Nasr City,1,8 days,backend,"·, ASP.Net, Computer Engineering, Engineering, .Net, Information Technology (IT), Software Development, SQL, Web Development",
TXG.,Senior Backend Developer (Node.js),Cairo,1,19 days,backend,"·, API, CI/CD, Github, PostgreSQL, REST, Fastify, Node.js, Typescript",
HiRemoters,Spring Boot BackEnd Developer /Freelancer OR Full Time,Cairo,1,11 days,backend,"·, Computer Engineering, Computer Science, Java, MongoDB, Spring, API",
E-Jawdah,Back-end Team Lead,Nasr City,1,18 days,backend,"·, PHP, RESTful APIs., Git, HTML, JavaScript, CSS, Ruby",
Confidential,Backend Team Lead,Smouha,1,21 days,backend,"·, Communication skills, Scrum, Java, Spring Boot, Microservices Architecture",
ISTQSERVERS ,Senior Backend Developer,Maadi,1,14 days,backend,"·, PHP, Node.js, Linux, MySQL",
TXG ,Mid - Senior Backend Developer (Node.js),Cairo,1,18 days,backend,"·, Git, TypeScript, API, PostgreSQL, Github, CI/CD, Node.js, Fastify, REST",
Devency  ,Frontend Engineer,Nozha,1,,frontend,"·, Software Development, Engineering, React, React.js, UI, Typescript, Agile",
Bright Creations,DAZU - React Frontend Developer,Smart Village,1,,frontend,"·, Sass, JavaScript, CSS, UI, HTML5, Software Development, Vue.js",
Link Development,Senior Front-End Engineer / Angular,Maadi,1,,frontend,"·, Angular, Computer Science, Git, HTML5, Information Technology (IT), JavaScript, jQuery",
Aria Systems,Senior Front-End Developer (Angular ),Maadi,1,12 days,frontend,"·, Information Technology (IT), Telecommunication, Computer Science, .NET, .NET Development, Angular, CSS, HTML5",
Charisma Design,Frontend,Nasr City,1,,frontend,"·, HTML5, CSS3, JavaScript, Vue.js, nuxstjs",
34ML,Vue.Js Frontend Developer,Heliopolis,1,11 days,frontend,"·, Software Development, Information Technology (IT), REST, Mobile Development, Objective-C, Software Design, UI",
Itechs Group,Software Engineer (Frontend),Nasr City,1,,frontend,"·, CSS3, Git, HTML5, JavaScript, Redux, RESTful, Information Technology (IT), Software Engineering",
Ultimate Solutions Egypt,Senior Front-End Angular Developer,Victoria,1,19 days,frontend,"·, Angular, APIs, Computer Science, CSS3, Design, Git",
HiRemoters,Angular Front-End Developer - Full Time Or Freelancer,Cairo,1,11 days,frontend,"·, Angular, Computer Engineering, Computer Science, CSS, HTML, JavaScript, MySQL, AngularJS",
Confidential,Frontend Team Lead,Smouha,1,21 days,frontend,"·, Agile Scrum, Angular, Communication skills, JavaScript, UI/UX design, DevOps, Dockerm Kubernetes",
TXG ,Senior Frontend Developer (React),Cairo,1,19 days,frontend,"·, Git, React, TypeScript, RESTful APIs, HTML5, CSS3, Code, Computer Science",
Smartly,"Front-End Developer (Blazor, React, Vue, Angular)",Nasr City,1,23 days,frontend,"·, Blazor, React, Vue.js",
SellAbroad,Frontend Engineer,New Cairo,1,1 month,frontend,"·, Agile, JavaScript, React, typescript, tailwind",
Egabi FSI,Senior Frontend Developer- Angular,Sheraton,1,1 month,frontend,"·, Computer Science, Information Technology (IT), javaScript, CSS, CSS3, Software Development, Angular2+, Angular",
Osus Group ,Frontend Developer - Fully Remote Job,Cairo,1,1 month,frontend,"·, CSS3, Computer Science, Software Development, Software Engineering, HTML5, Information Technology (IT), JavaScript",
HYVE Technology Consulting ,Data Scientist,Cairo,1,,Data scientist,"·, Computer Science, Engineering, Hadoop, Information Technology (IT), Java, Python",
DOT Information Technology,Senior Data Scientist,New Cairo,1,2 months,Data scientist,"·, Machine Learning, Information Technology (IT), Programming, NLP",
HYVE Technology Consulting ,Data Engineer,Cairo,1,,Data scientist,"·, Computer Engineering, Computer Science, Engineering, Ibm, Information Technology (IT)",
Alshaya,Senior Manager - Data Analytics,Nasr City,1,,Data scientist,"·, CRM, Quantitative Research, Commercial Analysis, Performance Measurement, Loyalty Programme, Performance Analytics, Loyalty Programme Analytics",
Alshaya,Manager - Data Analytics,Cairo,1,1 month,Data scientist,"·, Business Analysis, Reporting, Analysis",
BI-Technologies,Senior Power BI Developer,New Cairo,1,2 months,Data scientist,"·, Computer Science, Power BI, SSRS, BI, SQL, Microsoft Power BI, Engineering",
BrickRed Technologies,Sr. Data Engineer,Cairo,1,2 months,Data scientist,"·, cloudera, Computer Science, Banking, SQL, Information Technology (IT), Engineering",
Link Development,AI Engineering Manager,Cairo,1,,Data scientist,"·, Computer Science, BI, Software Engineering, SQL, Software Development, Power BI, SSRS, SQL Server",
Confidential,Data Analyst,New Cairo,1,2 months,Data scientist,"·, Computer Science, Engineering, Information Technology (IT)",
Lumin,Senior AI Engineer,Sheikh Zayed,1,9 days,Data scientist,"·, AI, Artificial Intelligence, Computer Vision, Machine Learning, TensorFlow, Python, Computer Science, Programming, PyTorch",
classera,Full Stack Developer,New Beni Suef,1,,Data scientist,"·, Computer Science, Java, MySQL, React, .Net, Full Stack, Software Development",
CodeCooks,Full Stack Developer,New Cairo,1,17 days,Data scientist,"·, Full Stack Developer, Information Technology (IT), Computer Science, Software Development, Full Stack",
OTIC,Python Backend Developer – AI & Chatbots,New Cairo,1,2 months,Data scientist,"·, Python Backend Developer, Database, Computer Science, Azure, APIs, Software Development, Oracle, Python, Django",
"Institute of Marine Engineering, Science & Technology (IMarEST)",Marine Surveyor,Dubai,1,,Data scientist,"·, engineering, civil engineering, dredging, construction, marine, autocad, marine construction",
HYVE Technology Consulting ,Data Engineer,Cairo,1,,Data engineer,"·, Computer Science, Ibm, Information Technology (IT)",
HYVE Technology Consulting ,Tech Lead Data Engineering,Nasr City,1,,Data engineer,"·, ETL, Hadoop, Python, SQL",
ISST-FIBER OCEAN,Sales Engineer (Data Center solution),Maadi,1,,Data engineer,"·, Sales, Sales Field",
Confidential,Data Analyst,Cairo,1,,Data engineer,"·, Analyzing, Computer Science, Analysis, Information Technology (IT)",
HYVE Technology Consulting ,Data Scientist,Cairo,1,,Data engineer,"·, Computer Science, Hadoop, Information Technology (IT), Java, Python",
WUZZUF,Data Analysis Manager,Maadi,1,9 days,Data engineer,"·, Analysis, business, Computer Science, Microsoft Excel",
ISST-FIBER OCEAN,Electrical Engineer (UPS / AC power solutions),Maadi,1,,Data engineer,"·, AutoCAD, Communication, Power, Electrical, Troubleshooting",
ISST-FIBER OCEAN,Electrical Engineer ( DC power solutions),Maadi,1,,Data engineer,"·, AutoCAD, Communication, Power, Electrical, Troubleshooting",
Harvest Foods,Quality Assurance Engineer,6th of October,1,,Data engineer,"·, quality, Quality Assurance, Quality Control, Communication skills, regulatory",
UNI Power,Sales Engineer,6th of October,1,16 days,Data engineer,"·, Ups, solar, Electrical, Solar Energy",
COB Solution ,Data Engineer,Maadi,1,1 month,Data engineer,"·, Computer Science, Development, Python",
Fixed Solutions,Presales Engineer,Cairo,1,9 days,Data engineer,"·, Pre-Sales, sales skills, Science, Software, Software Development, Computer Science",
Micro Engineering,Data Entry Specialist,Heliopolis,1,,Data engineer,"·, entry, English, Skills, Communication, Communication skills",
Link Development,AI Engineering Manager,Cairo,1,,Data engineer,"·, Computer Science, BI, SQL, Software Development, Power BI, SSRS, SQL Server",
Fixed Solutions,Senior Network Security Engineer,Cairo,1,9 days,Data engineer,"·, Information Technology (IT), Installation, Networks, Computer Science, Network Security, Maintenance",
CompactSoft International ,Software Developer .NET (Backoffice / Backend),Nasr City,2,8 days,software,"·, ASP.Net, Computer Engineering, Engineering, .Net, Information Technology (IT), SQL, Web Development",
Our Education,Senior Software Tester,Nasr City,2,9 days,software,"·, Computer Science, Test Automation, Engineering, Information Technology (IT), Quality Control, Selenium, Quality",
Code SA Ltd,Senior Software Engineer,Cambridge,2,10 days,software,"·, Python, APIs, Docker, React.js, Flask, FastAPI, Django",
Guestna,Software Development Manager - Remote (Full Time / Part Time),Riyadh,2,14 days,software,"·, Computer Science, DevOps, Development, APIs, Agile, Information Technology (IT)",
Landmarks consulting solutions CO ,Software Sales Account Executive – ERP Systems,Maadi,2,14 days,software,"·, Customer Support, Technical Support, ERP System, CRM System, Business Administration, Business Development",
MCBS,Sales Executive – Software,Mokattam,2,15 days,software,"·, Sales, B2B Sales, Negotiation, sales skills, Sales Target, Communication",
Route ِAcademy,Software Testing Instructor,Alexandria,2,15 days,software,"·, Teaching & Instruction, Communication & Presentation Skills, Student Support & Feedback",
Tafeel,Software Engineer,Riyadh,2,16 days,software,"·, Quality Assurance, Information Technology (IT), ISTQB, Computer Science, Testing",
Mint-Ops,Software Project Manager,Nasr City,2,,software,"·, JIRA, Slack, Gitlab, FigJam, Figma, Confluence, Google Docs, Google Sheets",
Al Ateeq Software,Software Tester,New Nozha,2,18 days,software,"·, Information Technology (IT), Quality Control, Testing, ISTQB, Computer Science",
Egyptian Company for Cosmetics,Procurement specialist ( IT & Software ),Nasr City,2,18 days,software,"·, Procurement, Purchasing, Negotiation, IT procurement",
CompactSoft International ,Software Sales Account Manager - ERP SYSTEMS,Nasr City,2,8 days,software,"·, sales skills, Customer Service, Experience, Sales Target, Sales, communications",
Naba Soft ,Software Tester,Nasr City,2,19 days,software,"·, Information Technology (IT), Quality Control, Tester, Computer Science",
Ultimate Solutions Egypt,Senior Software Tester,Sheikh Zayed,2,19 days,software,"·, Computer Science, Information Technology (IT), Selenium, API",
Nacita,Full-stack Software Engineer,Cairo,2,21 days,software,"·, full-stack engineer, angular, Agile, Java, nodejs, Kubernetes, Google Cloud",
Alfa Software,Odoo Developer,Hurghada,2,,python,"·, Odoo, Odoo Development, Odoo ERP, Computer Science, Information Technology (IT)",
OTIC,Python Backend Developer – AI & Chatbots,New Cairo,2,2 months,python,"·, Database, Computer Science, Azure, APIs, Software Development, Oracle, Django",
softprimes,Odoo Developer (80% Remote),Nasr City,2,8 days,python,"·, HTML5, Software Development, Full Stack, Odoo",
Algoriza,Senior Devops Engineer,Giza,2,9 days,python,"·, Azure, AWS, Cloud, Computer Science, DevOps, Docker, Engineering, Information Technology (IT)",
Lumin,Senior AI Engineer,Sheikh Zayed,2,9 days,python,"·, AI, Artificial Intelligence, Computer Vision, Machine Learning, TensorFlow, Computer Science, Programming, PyTorch",
Smicolon GmbH,Senior Full Stack Engineer,Munich,2,11 days,python,"·, Full Stack, Git, Computer Science, APIs, Information Technology (IT), Java, JavaScript",
Kandil Industries,Odoo Developer,Nasr City,2,,python,"·, Odoo, Information Technology (IT), Computer Science",
softprimes,Odoo Sales Account Manager,Nasr City,2,,python,"·, Odoo, B2B Sales, B2B, Business Development, Negotiation, Sales Target, CRM",
أكاديمية ابداع للتدريب والاستشارات (Ibdaa Academy),Engineer-,Fleming,2,14 days,python,"·, Computer Science, Engineering, Information Technology (IT), Arduino, Teaching, Development, Software Development",
MEAHCO Saudi German Health,Value-Based Healthcare Analytics Specialist,Maadi,2,18 days,python,"·, SQL, SAS, Tableau, Power BI, QlikView, Microsoft Excel, Microsoft Azure, AWS",
Confidential,Financial Analyst,Cairo,2,10 days,python,"·, Accounting, Commerce, Analyst, Analysis, Finance, Financial Analysis, Planning",
Cultiv,IoT/PCB Lab Specialist - ASSUIT,New Assuit,2,15 days,python,"·, EAGLE, Altium, Proteus, Electrical Engineering, C, Electronics, Embedded Systems, Hardware, IOT",
Cultiv,IoT /PCB Lab Specialist - BORG,Bourj Alarab,2,15 days,python,"·, EAGLE, Altium, Proteus, Electrical Engineering, Embedded Systems, Hardware, IOT, PCB",
34ML,Cloud Infrastructure Engineer,Heliopolis,2,11 days,python,"·, Software Development, Information Technology (IT), Web Development, Computer Engineering, Software Engineering, PHP, Laravel, Image Recognition",
Quantanite,AI Engineer,Maadi,2,18 days,python,"·, AI, Algorithms, Computer Science, Information Technology (IT), Engineering, Software",
Alshaya,Senior Manager - Data Analytics,Nasr City,2,,Data engineer,"·, CRM, Quantitative Research, Commercial Analysis, Performance Measurement, Loyalty Programme, Performance Analytics, Loyalty Programme Analytics",
Citylogix ME  ,Pavement Assessment Engineer,New Cairo,2,,Data engineer,"·, Roads, QA, Highways",
Marmonil Marble & Granite,Quality Engineer,Katameya,2,,Data engineer,"·, Quality Assurance, quality, Quality Control, ISO, ISO 9001",
Quantanite,AI Engineer,Maadi,2,18 days,Data engineer,"·, AI, Algorithms, Computer Science, Information Technology (IT), Python, Software",
Pure Group ,AI Engineer,Cairo,2,,Data engineer,"·, AI, LMS, FFT, Python, Frameworks, PyTorch, TensorFlow, NLP",
Bouri Group,Process Engineer (Plastic Injection Molding),New Cairo,2,8 days,Data engineer,"·, Process Improvement, Mechanical, Industrial, plastic injection, Injection molding, Plastic Injection Molding",
Softec Technologies,Software Application Support Engineer,Maadi,2,9 days,Data engineer,"·, Technical Support, Information Technology (IT), Computer Science, Troubleshooting, Networking, English",
CSCEC International Facade Egypt Co Ltd,Planner Engineer,Alamein,2,,Data engineer,"·, Construction, Analysis, Planning, Management",
Better Home,Sales Engineer - Ready Mix Concrete,New Cairo,2,,Data engineer,"·, Communication, Negotiation, Sales, sales skills, Sales Target",
Amer Vision Group,Technical Office Civil Engineer,Sheraton,2,,Data engineer,"·, Civil, AutoCAD, Management, Time Management, Projects",
GLC Paints,Surveying and Drawing Engineer,Obour City,2,11 days,Data engineer,"·, 3D, Architecture, AutoCAD, Civil, Communication, Drawing",
Scope IMS,Sales Engineer,Heliopolis,2,9 days,Data engineer,"·, Sales, Business Development, sales skills, Account Management, Electrical, Marketing",
Hamza Group,Sales Engineer,Dokki,2,8 days,Data engineer,"·, CRM, Communication, English, Mechanical, Microsoft Office, Pumps",
Confidential,Reliability Engineer,Alexandria,2,,Data engineer,"·, Management, Reliability, Maintenance, Docker, Azure, AWS",
Super Pack for Engineering Industries,Design Engineer,6th of October,2,,Data engineer,"·, Computer Science, CAD, CAD Software, Design, Information Technology (IT), Mechanical",
Nacita,Quality Software Engineer,Giza,3,21 days,software,"·, Agile, Computer Science, Engineering, Information Technology (IT), Programming, Java",
Amit Learning,Software Testing Instructor,Maadi,3,22 days,software,"·, Selenium, Automation, Java, Testing, ISTQB, JavaScript",
eVision,Software Developer,New Cairo,3,22 days,software,"·, APIs, Computer Science, Java, RESTful, SQL, Engineering",
Sourcya,Software Project Manager,Alexandria,3,17 days,software,"·, Microsoft Project, Project Management, Agile, Scrum, Asana, Trello, Negotiation, Computer Science",
Off-Beat,Junior Embedded Software Engineer,Heliopolis,3,24 days,software,"·, Programming, Embedded Systems, Computer Science",
Specialized Seamless Services ,Software Engineer,Cairo,3,24 days,software,"·, CCNA, mssa, Radiology Information System, Computer Science, Information Technology (IT), SQL",
Confidential,"Software Engineer "" Website Back End """,Maadi,3,23 days,software,"·, Computer Science, Information technology, Information Technology (IT), Odoo, English, back-end",
realme,Software Testing Engineer,New Cairo,3,26 days,software,"·, Communication, Information Technology (IT), Engineering, Testing, Electronics",
compsoft,AI & Software Trainer,Giza,3,25 days,software,"·, Computer Science, Information Technology (IT), AI, Big Data",
Aureka,Software Developer,Nasr City,3,1 month,software,"·, ASP.Net, JavaScript, Java, HTML, Python, CSS",
Confidential,Software Tester,Dokki,3,1 month,software,"·, Test, tester, Testing, Information Technology (IT), Computer Science",
Efada Technology,"Software Developer ""Outsourced Cash team""",6th of October,3,1 month,software,"·, Agile, Information Technology (IT), Java, Computer Science, Agile Methodology, AWS, Cloud",
Efada Technology,"Software Developer ""Outsourced""",6th of October,3,1 month,software,"·, Computer Science, Information Technology (IT), Java, Design, Spring, RabbitMQ",
InaWaks,Frontend Developer,Cairo,2,1 month,frontend,"·, React, JavaScript, Information Technology (IT), HTML, CSS, Web Development, Software Development",
MIBA LLC,Full-Stack Developer (Front-End & Back-End),10th of Ramadan City,2,1 month,frontend,"·, c++, CSS, HTML, MongoDB, Python, Node.js, JavaScript",
النورس للتجاره ,Senior Frontend Developer,New Nozha,2,1 month,frontend,"·, Angular, Computer Science, Design, Git, CSS, HTML, Information Technology (IT), JavaScript, React",
Quanvex,Senior Front-End Developer – React (Remote),New Assuit,2,2 months,frontend,"·, React, HTML, CSS, JavaScript, Agile, Information Technology (IT), Software Development, Web Design",
Dash Code,Senior Front-End Developer,Cairo,2,2 months,frontend,"·, CSS, HTML, Git, Information Technology (IT), Sass, JavaScript, Web Development, back-end",
Bnaia,Senior Front-End Developer,Maadi,2,2 months,frontend,"·, API, Computer Science, CSS, CSS3, Git, HTML",
Bee Informatic tecknology,Software Tester / QA Engineer,Dokki,3,1 month,software,"·, Computer Science, Testing, Information Technology (IT), SQL, Postman, Automation",
Osus Group ,Software Tester - Fully Remote Job,Cairo,3,1 month,software,"·, Quality Assurance, System Testing, Testing, Automation Testing, User Testing",
Confidential,Front End Developer,Maadi,2,,frontend,"·, APIs, CSS3, Git, HTML5, JavaScript, RESTful, Software Development, Vue.js",
RISEUP (Endemag for Administrative Skills Development),Senior web engineer lead,Nasr City,2,,frontend,"·, JavaScript, HTML, CSS, Vuex (State Management), Vue Router, Webpack, NPM / Yarn, RESTful APIs, GraphQL",
Al Ateeq Software,Senior Front End Developer,Heliopolis,2,,frontend,"·, Angular, Communication skills, Computer Science, Information Technology (IT), Software Engineering, UI/UX, Development",
Bright Creations,Fintech - Head of Engineering,Smart Village,2,,frontend,"·, Agile, back-end, Engineering, Computer Science, Management, Project Management",
WANAGG,Front-End Developer (Angular),Cairo,2,2 months,frontend,"·, Angular, Computer Science, developer, Information Technology (IT), Software Development",
Our Education,Senior PHP Developer (Laravel),Nasr City,2,9 days,frontend,"·, PHP, Computer Science, Laravel, HTML5, CSS3, MVC, Programming, javaScript",
Gahbiz.com,Web Developer,Sidi Gaber,2,,frontend,"·, API, backend, Computer Science, Development, Information Technology (IT), Js, Laravel, Node.js",
Expert Apps,Senior UI/UX Designer,Maadi,2,8 days,frontend,"·, UI, UI/UX, UX, Design, Android, Web Development, UI Design",
Holix,Full-Stack Developer (Next.js & NestJS),Cairo,2,9 days,frontend,"·, HTML5, Git, API, CSS3, React, MongoDB, SEO",
Storlytics ,Renewable Energy Engineer,Cairo,3,21 days,python,"·, English, AutoCAD, Electrical Engineering, Renewable Energy, Power, PVsyst",
Groupe- Atlantic,Assembly process Engineer,10th of Ramadan City,3,18 days,python,"·, Engineering, Mechanical Engineering, Production, Process, Manufacturing, Process Improvement, Six Sigma",
